ID,Body,Created At,Product ID,Rating,Reviewer
1,Ad perspiciatis quis et consectetur. Laboriosam fuga voluptas ut et modi ipsum. Odio et eum numquam eos nisi. Assumenda aut magnam libero maiores nobis vel beatae officia.,2018-05-15T20:25:48.517,1,5,christ
2,Reprehenderit non error architecto consequatur tempore temporibus. Voluptate ut accusantium quae est. Aut sit quidem nihil maxime dolores molestias. Enim vel optio est fugiat vitae cumque ut. Maiores laborum rerum quidem voluptate rerum.,2019-08-07T13:50:33.401,1,4,xavier
3,In aut numquam labore fuga. Et tempora sit et mollitia aut ullam et repellat. Aliquam sint tenetur culpa eius tenetur. Molestias ipsa est ut quisquam hic necessitatibus. Molestias maiores vero nesciunt.,2018-03-30T00:28:45.192,1,5,cameron.nitzsche
4,Est accusamus provident non animi labore minus aut mollitia. Officiis voluptatem quo dolorem sunt qui ipsum nobis totam. Et qui et qui quia ipsa ipsam minima.,2017-11-13T22:29:12.121,1,4,barbara-shields
5,Id sed sint corrupti molestias ad alias aut in. Nihil debitis ipsum repellendus voluptatem facere. Fugiat fugiat necessitatibus nobis hic.,2017-11-19T07:08:54.771,1,5,clement
6,Omnis pariatur autem adipisci eligendi. Eos aut accusantium dolorem et. Numquam vero debitis id provident odit doloremque enim.,2018-02-11T03:05:17.346,1,5,jaunita
7,Non unde voluptate nam quo. Quibusdam vero doloremque ut voluptas. Sequi commodi voluptatem vero debitis velit in. Quis dolores id qui aut voluptatibus. Magnam laborum sunt sit saepe reprehenderit.,2020-01-31T12:35:59.147,1,5,perry.ruecker
8,Quia ullam qui quae distinctio non nostrum laboriosam. Voluptatum velit et est dolore corporis sed. Dolore quia non illum quia omnis laudantium tempore.,2019-12-10T16:16:36.999,1,4,cristina.balistreri
9,Quo sed optio cum. Et officiis cumque quis. Facere unde porro sit voluptatem nulla incidunt. Rerum accusantium aut consequatur quae. Rerum ut eligendi vel repudiandae voluptates.,2019-11-06T10:43:14.868,3,4,wilma-muller
10,Est consectetur impedit sit. Distinctio corrupti ut magni provident recusandae aliquam qui error. Omnis et debitis pariatur doloribus quia blanditiis eaque. Voluptates ut eum minus quasi alias. Officiis nostrum facilis possimus.,2019-02-13T17:37:35.244,3,4,herman-marquardt
11,Blanditiis sequi reprehenderit nesciunt eos numquam a alias quibusdam. Et alias dolor vel. Non enim corporis magni dolorem voluptatem laudantium sit.,2018-10-22T23:12:30.534,3,4,carolyne
12,Sint sed et libero excepturi aut. Nihil tempora reprehenderit et et harum consectetur alias voluptatum. Sed et consequatur quibusdam natus nihil non illum.,2018-11-26T23:42:48.594,3,4,ralph-klocko
13,Enim consequatur voluptas temporibus iusto optio. Nihil et ea iste autem est. Accusamus sint corporis ullam.,2019-06-21T07:29:55.724,3,4,gerry
14,Placeat non inventore odit. Illum ullam rerum cum corrupti maiores. Nihil sequi molestias dolore explicabo doloremque nobis omnis. Saepe id voluptatem ut nemo. Commodi laborum qui amet hic rerum omnis iste.,2019-03-26T21:16:27.557,3,4,lula-pouros
15,Minus minima ea fugit vero consectetur. Voluptatibus dignissimos quibusdam alias quam eos deserunt maxime. Dolorem exercitationem ex nobis et esse odit accusamus voluptatum.,2019-11-30T07:00:39.059,3,4,jalon.pagac
16,Sint dicta facere cumque omnis autem. Non tempora voluptatem iure. Modi quia modi voluptatem. Autem ratione tempora qui.,2019-04-20T04:57:57.91,4,3,kale
17,Necessitatibus voluptatem officia iusto. Repudiandae distinctio accusantium quae officiis nisi. Eveniet voluptatem non molestias tempora maxime voluptas quas reiciendis. Explicabo ea non enim temporibus. Alias aspernatur quos et quia blanditiis repudiandae.,2018-07-28T13:49:57.756,4,1,kurt.labadie
18,Facere iusto aut autem vel qui. Velit nemo esse ipsum exercitationem est quam odit doloremque. Voluptate est molestias maxime porro. Ut exercitationem in est. Voluptates incidunt voluptatem officia.,2018-07-31T13:05:41.95,4,5,creola-price
19,Ad sit magnam voluptatem esse voluptatem. Natus ut quo labore soluta ex exercitationem. Sunt aperiam qui at.,2018-09-28T22:29:23.619,4,2,kaley-nader
20,Sit blanditiis in possimus. Ab voluptatem aliquid amet libero eos rem nemo. Sed officiis maiores id cum facere cupiditate veniam. Et magnam qui ea aliquid.,2019-10-09T01:52:47.56,4,4,brock
21,Eos consectetur adipisci perferendis neque laborum. Veritatis repellat eum distinctio vitae eum asperiores fuga illo. Tempora iusto aut rerum aut reprehenderit. Eos aut veritatis assumenda omnis.,2019-09-18T23:37:03.454,5,4,meghan
22,Et libero velit recusandae voluptas adipisci voluptatem nulla. Odit minima totam vel. Est dolore porro ratione tempore.,2019-08-20T19:36:44.051,5,5,pedro
23,Voluptatem nulla quia ea dicta. Voluptatem vel commodi in. Quisquam architecto quas ea perferendis.,2017-09-26T22:31:06.534,5,5,theresa
24,Non sint sit aut unde. Ullam ut delectus ipsam consequatur. Dolor sed dolor est dolorem dolores ipsa voluptatem dolor. Unde delectus optio inventore ab corporis voluptatibus.,2017-12-09T10:48:26.839,5,2,yoshiko
25,Fugiat corrupti perspiciatis laborum nulla debitis a soluta. Possimus ab quis laudantium amet nulla. Maiores aliquid voluptas magnam quia sunt autem.,2018-08-13T02:20:13.488,6,5,davin.rowe
26,Odit tempore maxime vel omnis id consequatur. Ratione non repellendus eaque. Optio sit expedita est et quia alias debitis. Incidunt ab alias est repellendus vel dolores qui.,2018-02-10T15:22:39.741,6,4,beatrice-ward
27,Minima non hic doloribus ipsa dolore ratione in numquam. Minima eos vel harum velit. Consequatur consequuntur culpa sed eum quidem. Debitis nostrum voluptatibus et voluptatem.,2020-01-07T06:01:18.999,6,4,grace
28,Et non est minima praesentium est. Nesciunt ipsa omnis est voluptatem provident dolores consequatur qui. Quos est architecto exercitationem soluta delectus adipisci minima.,2018-04-29T05:54:53.293,6,3,pete
29,Reprehenderit est neque sapiente at dolore aut facilis. Ea reprehenderit ut dicta et quia harum repellendus. Provident facilis nostrum quidem. Velit quod nobis dolore aspernatur suscipit.,2018-10-05T18:18:12.074,6,3,daryl
30,Inventore qui dolorum dicta nam dolor consequatur non. Ea libero dolorum est fugiat voluptatem voluptatum qui. Quod minus maxime sequi.,2019-11-22T04:12:40.052,7,3,mae.strosin
31,Reiciendis recusandae qui aperiam nam aperiam corporis et voluptatum. Dolor sapiente eum officiis doloribus cupiditate illum ullam soluta. Est totam provident et facere et odit quaerat.,2019-05-20T23:21:59.929,7,5,abigale.harvey
32,Aliquam sequi doloremque animi quod quia. Quos eum eum id perferendis quos praesentium et vel. Qui voluptas et dignissimos nisi.,2018-05-14T10:41:19.568,7,5,kylie.murphy
33,Quo animi voluptatem alias iste dolores iure asperiores accusantium. Nihil libero eum qui iure eligendi quo quis omnis. Necessitatibus et molestias ducimus aut. Maiores dolorem et est.,2018-04-18T21:32:02.295,7,5,terrell.brown
34,Voluptas illum officiis facere. Quas iure ut praesentium et. Sed soluta explicabo esse doloribus sed.,2019-04-15T22:18:56.792,7,3,devan.buckridge
35,Dolorem eos tenetur soluta cumque fugit quibusdam quia dicta. Omnis debitis cupiditate ipsa in veritatis sed dolore. Cumque sit eos commodi iure. Et recusandae optio quas blanditiis quasi enim impedit error.,2017-06-04T18:52:10.978,7,5,alexandrea.bartell
36,Et modi architecto cupiditate dolorem sapiente delectus et. Exercitationem consequatur non nihil delectus doloribus animi aliquid. Illum accusamus sed necessitatibus maxime eos. Et velit qui expedita laborum minima.,2018-02-10T18:40:43.685,7,4,michel.goodwin
37,Facilis laboriosam et expedita. Quasi accusamus architecto voluptas repellat quam expedita quidem odit. Voluptates nemo nam consequuntur doloribus corrupti nisi. Voluptatem quo excepturi veniam culpa est et.,2019-09-13T00:30:24.224,7,5,emerald-carroll
38,Id sed aut quo est. Vero et nobis numquam quis. Asperiores laudantium in reprehenderit quisquam. Architecto accusantium eaque adipisci. Sequi error doloremque quaerat laboriosam incidunt.,2018-09-28T02:16:05.922,8,2,skylar
39,Odit error sunt ipsam nihil. Esse vero voluptatibus maiores velit omnis aut nobis. Debitis quis vitae eum enim ad. Voluptate in quas quae eveniet.,2018-05-08T06:42:14.983,8,4,johnny
40,Explicabo aut ex numquam. Voluptas est voluptate quod dolor quod. Deserunt est eos quo qui consequatur exercitationem. Eaque quod vel ut. Non libero commodi saepe molestias magni.,2019-02-01T08:43:39.868,8,4,julio
41,Id tenetur eaque incidunt perspiciatis suscipit dolor. Qui quia alias doloribus eum omnis quis sunt. Accusantium quos eos tempora. Sit quibusdam alias sed voluptas voluptatem. Ut rem similique magnam et.,2019-12-01T02:56:24.429,8,5,noble
42,Repudiandae quae natus maxime suscipit deleniti rerum ut incidunt. Ipsam explicabo quia quo recusandae dolorum ad est officiis. Eligendi nobis consequatur voluptas molestiae saepe.,2019-07-15T04:28:05.737,8,4,juliana
43,Eum omnis facilis soluta qui nihil ullam minima modi. Culpa quos explicabo perferendis. Qui et et rerum animi. Et aut quos excepturi quod ipsum consectetur.,2019-06-09T20:03:22.823,8,5,alvis
44,Placeat est sint perspiciatis non eveniet sapiente porro voluptate. Quo est non voluptatem. Recusandae repellendus itaque id veniam. Et quam aut vitae praesentium voluptas vel sunt dolorum.,2018-11-18T02:46:20.771,8,5,ethel
45,Reiciendis omnis corporis recusandae dicta nostrum aspernatur quas maxime. Consequuntur recusandae consectetur officia. Et et qui et odit et aut qui. Doloremque excepturi fugiat rerum rerum consequatur totam laudantium.,2019-05-07T18:34:59.926,9,3,maia
46,Corporis perferendis aut accusantium temporibus omnis doloribus aut exercitationem. Qui sed dicta possimus omnis. Voluptas inventore ut soluta.,2019-04-23T00:40:26.426,9,5,trent
47,Quia eligendi amet qui omnis odit ut at. Nobis facere adipisci deserunt recusandae. Adipisci sint aspernatur enim et id. Repellat repellendus qui qui. Fuga accusantium dolorum fugiat numquam molestias qui.,2019-02-09T09:00:23.913,9,5,roslyn.goldner
48,Aperiam vero temporibus corporis corporis maiores voluptatem expedita. Voluptas ipsum cumque consequatur. Impedit ut sapiente quis voluptatem aut.,2019-12-29T02:05:23.696,9,4,reyna.davis
49,Incidunt totam non id laboriosam facere. Molestiae consequatur labore dignissimos voluptatem. Molestias quis autem adipisci.,2018-10-26T00:15:56.189,10,5,donnie.spinka
50,Omnis sed illum est maiores beatae ut corporis. Nihil iste quidem vel. Quas rerum ipsa fugiat fuga natus aliquam. Eligendi repudiandae accusantium at ea. Non numquam ut non est tenetur.,2018-03-18T17:28:46.007,10,5,jettie
51,Et velit voluptatem blanditiis. Sunt quidem iure aut et aspernatur. Id in totam voluptas asperiores non.,2020-01-06T12:53:43.611,10,4,luther
52,Et est voluptatibus qui corrupti. Nostrum fugit mollitia debitis eos voluptatem quis. Quis velit facilis provident corrupti veniam soluta officia aut. Provident occaecati minus vel ea et. Et quia atque eligendi voluptate.,2017-11-12T09:30:57.613,10,4,hazle
53,Eius voluptatem neque debitis ipsa earum et id quibusdam. Qui assumenda qui iure velit rerum ad voluptas sit. Odio at ex aperiam facere sed aut.,2019-10-18T07:00:46.983,10,5,lois-romaguera
54,Incidunt enim totam molestiae. Molestiae velit rerum sint est sed beatae. Officia totam tempora qui nesciunt adipisci qui.,2019-07-18T14:53:25.766,10,5,maeve
55,Dolor amet itaque odio at est nesciunt voluptas. Nostrum nisi nam aut est deleniti perspiciatis aut blanditiis. Nesciunt sit alias corrupti incidunt qui aut totam. Soluta corrupti qui in nulla et corrupti est.,2017-02-21T13:15:00.956,10,4,elizabeth
56,Fugiat dolores maiores tempora quis. Voluptate quod alias quidem saepe provident perspiciatis corrupti. Qui ut et quo non id laborum quia. Eligendi aut voluptatum omnis numquam corrupti ut.,2017-12-15T04:57:05.876,10,2,lois.jakubowski
57,Adipisci provident voluptate cum qui voluptatem. Ut quae velit velit rerum eveniet voluptas. Harum cum similique provident. Voluptatem quidem labore minima alias dolore. Molestiae voluptatem commodi ut et.,2018-11-22T01:05:33.863,10,5,rhea
58,Ut accusantium odit sit et nihil. Voluptatum eum voluptatibus sit et dolore sed sequi natus. Ducimus cupiditate perferendis repellat expedita quos.,2020-04-08T09:48:23.269,12,5,loren
59,Sed excepturi tempora saepe recusandae rerum in ex perferendis. Quia error quibusdam et omnis dolores totam. Quaerat qui ullam at omnis iusto. Voluptatem veniam optio maiores repellendus. Sunt minus ut eveniet voluptatem.,2018-05-02T07:46:44.29,12,5,fidel
60,Aperiam autem magni sunt. Tempora voluptates vitae facere. Asperiores repellendus totam ad ullam.,2018-04-26T00:55:59.488,12,5,meta
61,Dolorem eum dicta eum et. Laborum qui est et. Aut labore quia earum.,2020-01-01T16:50:17.06,12,5,dayton
62,Voluptate dolores est repellat. In tempora magni magni dicta autem amet. Et saepe autem provident facilis nostrum reprehenderit vero.,2020-01-22T00:59:08.252,12,4,meghan
63,Dicta animi pariatur totam qui necessitatibus illo omnis. Quaerat ut et nostrum rerum. Minus explicabo occaecati sed occaecati aliquid molestias dolorum. Saepe debitis velit maxime consequatur fuga.,2018-10-26T20:30:34.427,12,5,summer
64,Aut vel earum non. Nihil harum ullam accusantium voluptate. Voluptas doloremque inventore tempore quasi. Est magni dolor ratione placeat officia in sed sit.,2019-04-01T06:35:01.914,12,2,ollie-hudson
65,Eum nesciunt aut amet nobis. Vel rerum eligendi quae est sequi. Eaque quo ea inventore quas quo aliquam iusto est.,2020-03-29T01:22:49.789,14,4,michale-howe
66,Veritatis dolores error nisi libero cum a ut sunt. Et possimus in dignissimos. Dolorum saepe doloribus soluta sunt a. Optio consequatur quo ratione fugiat ipsum voluptatem neque. Modi corporis rerum et deleniti.,2019-11-01T13:30:33.826,14,4,tatum.williamson
67,Ut impedit ipsum eos. Fugiat voluptate dolor sed qui quasi aliquid sint sed. Deserunt accusamus reprehenderit aut. Esse tempora sint impedit amet eos et quaerat corrupti. Modi iure ut iure et eius temporibus dicta ut.,2019-01-26T04:20:49.869,14,4,lowell
68,Sed aut id facere. Nihil at doloribus eaque. Est molestiae ut non sapiente distinctio facere et totam. Aut dolorem ducimus eum quasi molestiae molestiae.,2019-04-30T17:32:10.886,15,5,jalen
69,Consectetur porro sed officia consequatur esse qui quas. In velit nemo facere sint nobis delectus qui optio. Harum iure nemo illum.,2017-02-12T15:12:41.758,15,4,stewart-west
70,Nobis eaque officia veritatis. Accusantium quae voluptas et harum neque facere sunt. Non iusto repudiandae ut dolorum est. Omnis delectus laboriosam soluta odio. Assumenda quod ducimus id accusantium in assumenda ut.,2019-07-01T14:38:02.218,15,3,ryder.schmeler
71,Sunt id ea occaecati ipsam itaque qui. Consectetur eveniet et rerum quos. Est suscipit temporibus ut alias aut. Possimus blanditiis nam voluptas. Pariatur debitis officiis qui.,2019-01-09T16:46:13.739,15,5,noble.bins
72,Amet deserunt iusto ut optio natus quia eos qui. Optio sed ea doloribus. Mollitia vel voluptas eum commodi.,2017-01-26T12:42:53.019,15,3,alan
73,Enim ea possimus cum. Tempora harum blanditiis facilis modi quos. Voluptas officia est itaque.,2018-10-01T17:14:12.497,15,4,shawn
74,Nulla quibusdam ad voluptatem consequatur voluptatem blanditiis dolorem. Omnis et assumenda eum quisquam natus. Eligendi ut numquam veniam eaque tempore incidunt rerum consequatur.,2018-02-13T04:11:25.169,16,4,sylvia
75,Hic quae officiis quas nostrum quo delectus corporis et. Sed a omnis quae blanditiis magnam et et. Asperiores neque nulla totam ea aut in possimus.,2019-12-03T10:22:06.543,16,4,dalton
76,Hic architecto nobis adipisci inventore numquam. Nam reiciendis ut eligendi consectetur a iusto beatae. Ipsam eius ea repudiandae aut.,2017-07-31T22:46:52.399,16,5,laverne
77,Omnis ipsam culpa voluptas repudiandae. Magnam quae veniam quia et. Laborum officia eum repudiandae id commodi.,2017-10-29T21:09:52.952,16,2,kamron.hickle
78,Magnam tenetur voluptas nihil. Dolor similique voluptas quos hic amet in ut. Nihil aperiam non omnis tempora. Aut dolores quod voluptate quis quis itaque incidunt esse.,2017-04-21T10:28:11.664,16,4,ernestina
79,Et enim libero accusamus et aliquid odit ratione. Sit ea error nulla aliquid facere. Est minus quibusdam iusto. Id ipsa vitae dolor minima autem quisquam odio quibusdam. Adipisci occaecati ea delectus quia.,2018-05-10T09:41:43.463,16,4,darren
80,Et voluptas repellat sed amet non recusandae voluptatem. Voluptatem minima corrupti sunt explicabo ut porro est. Ut dolor reiciendis eaque voluptate qui suscipit. Ipsum culpa vel molestias. Ipsa enim animi saepe autem quibusdam suscipit recusandae sequi.,2018-09-24T17:13:21.925,16,5,fritz-strosin
81,Consequatur labore fuga aut eum sint qui earum aut. Consequatur exercitationem accusamus sunt dolor aut non ut. Ut pariatur vitae iste est quod dicta. Similique ab voluptatibus sunt dolor aliquam et voluptates.,2020-04-05T13:29:00.434,17,4,joshuah
82,Quia aliquid eveniet tenetur est. Et odio similique autem ipsam nihil ratione. Autem quae sit nostrum.,2018-07-30T10:22:43.084,17,4,cristina.bruen
83,Velit alias voluptatibus soluta suscipit ipsam et non. In ducimus quia ut veniam libero et. Nostrum sequi fugiat provident.,2019-10-21T10:03:50.501,17,5,vada.mcdermott
84,Nihil expedita ut fuga id nesciunt rerum quam dicta. Iure quibusdam dolor labore dolorum debitis explicabo sit. Optio et deserunt quasi aut. Velit eos ut quasi quis quam.,2019-07-29T16:57:45.908,17,4,sadye
85,A repellat impedit explicabo ullam. Et ad quis temporibus. Voluptas tenetur aspernatur saepe sequi animi veritatis et culpa.,2020-01-21T18:52:03.42,17,4,emory-franecki
86,Aperiam placeat aut ab veniam id. Quisquam atque dolores voluptatibus illum. Numquam aliquid ea cumque quia minus corporis voluptatem et. Vitae delectus quidem ea iste sint. Qui aliquam ut est ipsa.,2020-03-30T07:27:53.68,17,4,tiana-pfeffer
87,Alias saepe enim qui tempore modi. Quaerat rem mollitia quia. Aut tempora aut laborum. Et et debitis nihil atque eveniet. Et dolore perspiciatis deserunt beatae occaecati aut ex fuga.,2018-05-01T16:04:00.03,17,5,destany.cremin
88,Odit est et et ex velit doloremque non. Commodi officiis ea maxime et enim qui eum voluptatem. Nisi autem blanditiis illo et pariatur quas.,2019-07-28T22:16:44.098,17,5,jovany
89,Nihil natus doloribus sit officia quidem nostrum quos minus. Quis animi officia est qui. Sunt ipsum ea modi. Quibusdam accusamus maxime reiciendis et eveniet illum eos beatae. Culpa similique ab quisquam.,2019-02-28T22:00:41.936,17,4,kurt.watsica
90,Voluptas repudiandae qui ut aut. Esse cumque deleniti alias quaerat est et. Quia optio unde unde pariatur et hic.,2017-08-09T06:39:07.732,17,4,ethel
91,Dolor totam et tempora quam dolorem nemo. Voluptatem dolore exercitationem rerum accusamus quod cum. Aliquam delectus pariatur ut et consequatur id.,2017-04-19T16:27:24.305,17,4,jimmy
92,Aut pariatur totam non delectus. Vitae dolor libero velit fugit quae dolore officiis distinctio. Sit quia ut autem eveniet aperiam. Qui ratione aliquam quis ex sapiente ab assumenda.,2019-02-03T22:07:12.049,17,4,macie
93,Ut qui aut nemo inventore id optio vero. Omnis iusto dolores sequi ipsum reiciendis qui ipsam dolor. Ut optio quisquam non omnis harum placeat ad.,2017-10-14T20:29:26.065,17,5,mckenzie-stehr
94,Dolor excepturi aut ut. Officia quas laboriosam tempore. Ut praesentium laborum aut consectetur esse quae suscipit.,2019-12-30T08:09:08.127,18,5,geoffrey.von
95,Molestiae quisquam qui quos est aut. Occaecati nostrum est eligendi nam quia vero eius reprehenderit. Repellendus eligendi architecto ea.,2019-05-18T19:45:39.728,18,4,angela-schultz
96,Ut molestias et architecto optio. Eius cum ut deserunt. Et magnam quasi autem ex occaecati ullam alias magni.,2018-12-05T21:47:07.095,18,5,adam
97,Corporis enim ea in ut. Iusto magni sequi doloribus consequatur qui. Qui in ullam debitis atque necessitatibus. Quia aut modi deserunt ratione.,2017-05-02T23:14:47.478,18,4,desmond-barton
98,Et est fugiat velit animi cumque quis dolor. Consequuntur eius aut doloremque qui est rem deleniti ut. Nostrum nisi non ullam velit beatae fuga.,2019-07-08T11:53:28.944,18,4,brennan.watsica
99,Neque magnam aliquam ab qui est aspernatur autem. Vel eius eligendi exercitationem voluptatem voluptas. Enim nulla et ratione voluptatem nisi. Non in consequatur voluptatum. Beatae dolorum qui quaerat atque.,2017-02-21T00:05:47.233,18,5,dale
100,Incidunt totam perferendis et accusantium deserunt. Totam magnam aut ab veritatis aut aut. Perferendis ad aut ipsum qui rerum nihil. Non pariatur dolor enim voluptas fugiat natus itaque. Eum qui quia distinctio explicabo pariatur vel quam.,2018-02-19T09:40:51.384,18,4,joannie
101,Quia et ut quia veritatis officiis veritatis molestiae. Ipsam et vitae dolor accusantium aut sed. Exercitationem et quam qui amet ut veritatis voluptatem dolores. Ut maiores et cumque rem aut. Quia deserunt qui quasi nesciunt qui animi.,2019-02-15T21:26:38.194,19,4,glenna.friesen
102,Nemo omnis dignissimos eligendi. Quod nesciunt dolorum sit incidunt ipsam. Reiciendis odio eius blanditiis nobis quia cum veritatis sapiente. Ad rerum quasi eum corrupti. Soluta asperiores vitae placeat ipsam suscipit odit minus.,2016-12-10T15:46:07.837,19,3,saul
103,Delectus voluptas est a laudantium repudiandae. Enim at hic ex mollitia non sed atque officiis. Dolorum ullam et quae nihil sed aliquam cumque adipisci.,2019-02-11T07:32:34.363,19,5,viviane.torphy
104,Ducimus debitis laudantium quae molestias. Corrupti dolor dicta omnis eius placeat. Sed dolorum inventore et. Expedita soluta ipsa eligendi nihil ea. Velit quae aut molestiae ipsum sit.,2018-05-05T23:32:43.969,19,5,lucio-kuphal
105,Omnis maiores quisquam hic sint facere ad. Incidunt optio rerum incidunt doloremque. Maiores est nihil est voluptas exercitationem earum molestias. Quos voluptatem qui aperiam. Qui quis molestiae vitae et aut laboriosam aut dolores.,2019-01-24T15:15:18.982,20,4,janessa.durgan
106,Accusantium sit non ea dignissimos ut vero. Repudiandae quia eveniet consequatur ducimus. Laboriosam et quia dolore nihil mollitia voluptas amet. Dolores itaque praesentium fugiat possimus. Quo cum nesciunt et.,2018-08-20T23:57:09.28,20,5,davin.marks
107,Porro nobis magni dolore omnis. Sint nam et ducimus earum necessitatibus itaque quia ut. Voluptatibus aut eum nemo provident accusamus deleniti culpa impedit. Voluptas eaque sunt necessitatibus totam accusamus nemo.,2019-05-09T12:58:15.499,20,4,aditya.mills
108,Similique ut molestiae eligendi et placeat reiciendis sint. Quam quibusdam qui sapiente nostrum nam vel sed. Alias ut officiis molestias eaque dolorem necessitatibus.,2020-01-14T13:35:58.791,20,3,camryn-homenick
109,Aut occaecati voluptatem est dolor est beatae. Consequatur error id omnis. Porro occaecati et voluptates unde. Qui officia sit deleniti omnis illo tenetur. Rerum occaecati est excepturi eaque sint explicabo quas ut.,2019-11-11T03:47:13.31,20,4,markus
110,Facilis iure libero voluptatum enim temporibus quisquam laborum aut. Delectus voluptas incidunt dicta et rerum officiis. Veniam aperiam qui consequatur ipsum rerum. Et maxime veniam magnam. Molestiae magni voluptatum amet et autem fugiat.,2018-12-01T07:57:48.65,20,4,myrl-tromp
111,Dicta aut et sit dolores id. Eum non sed assumenda fugiat esse eveniet. Molestias fuga est repellendus sed rerum vel. Nobis eos et sit.,2019-10-07T20:24:12.718,21,4,antwon
112,Et ullam debitis totam. Possimus voluptate ut sit vel quo natus fugit enim. Quasi doloremque ut ullam. Dolorem culpa dolor ut dolores.,2018-02-25T08:54:38.338,21,4,adella
113,Dolores quo voluptatem enim sit quaerat laborum explicabo atque. Itaque eos neque aliquam qui. At et voluptatibus sed enim cupiditate. Consequatur sit sit eaque sed itaque ea fugiat ut. Et repellendus hic quas.,2018-12-24T14:48:04.023,21,4,bo-lebsack
114,Est fuga ex amet corrupti aliquid earum. Necessitatibus est fugit harum voluptas. Iure consequatur tempore commodi.,2016-08-26T19:15:54.665,21,5,therese
115,Laborum non commodi dolores qui perferendis voluptatem omnis quisquam. Dolorum et praesentium nulla saepe. Eaque sit dolorem ut laudantium consequatur nostrum autem.,2017-11-21T09:46:48.796,21,4,isaac
116,Qui omnis numquam quae quia. Ut voluptate modi praesentium. Aut reiciendis sit adipisci molestiae quia reprehenderit. Facilis ipsa consequatur commodi quia reprehenderit sint quae laboriosam.,2016-10-12T02:57:20.935,21,4,alayna
117,Sed est iste libero voluptatibus aut. Velit qui pariatur soluta vero ipsa aperiam. Est nihil enim vel sed explicabo labore rem. Sint ex repudiandae vitae eaque est. Autem architecto fuga inventore ad velit quae aperiam corporis.,2017-12-02T19:42:42.974,22,5,frederic-osinski
118,Assumenda ut sint necessitatibus. Sit vel excepturi tempore fuga error facere qui. Voluptatem magni qui non numquam repellat ut labore. Qui in consectetur quia repellat voluptas consequuntur consequatur. Nulla a eaque aliquid earum itaque accusamus atque.,2018-08-06T20:58:51.687,22,2,anais.erdman
119,Eos explicabo iste necessitatibus illum modi tempora velit ea. Hic alias ea quisquam facere. Temporibus voluptatum reiciendis autem ut nesciunt dolore ut ex. Atque eaque placeat dignissimos voluptatem ea repellendus voluptas.,2018-04-08T11:43:53.687,22,4,joanny
120,Nam tempore delectus harum et. Qui distinctio accusamus in ut. Id voluptas quod eos qui deserunt non. Non eveniet rem nemo error fugiat occaecati fugiat dicta.,2018-01-30T17:57:55.368,22,5,brannon.sipes
121,Numquam omnis enim inventore quia nobis vel. Harum ea rerum et est. Ipsum rem quibusdam deserunt laboriosam. Eum sapiente iure quia facere quibusdam voluptatem non et.,2018-12-02T13:18:42.648,22,5,river
122,Ratione dolor at temporibus ut qui mollitia vitae. Qui illum reiciendis facilis. Praesentium a eligendi nihil. Labore et ut ipsum sequi et. Vel qui incidunt quo impedit nesciunt.,2019-12-06T17:49:54.431,22,4,tomas.roberts
