ID,Body,Created At,Product ID,Rating,Reviewer
819,Voluptatem dolorum sed est rem optio esse aperiam. Ullam voluptas voluptatibus reprehenderit ducimus. Laboriosam maiores id dolore et a.,2016-11-14T03:44:05.51,146,5,elisha
820,Eligendi perferendis aut adipisci impedit autem. Repellendus asperiores cupiditate quam sint eum ipsum sit. Animi sed et dicta hic maiores quis vel. Eligendi aliquid porro totam nostrum distinctio voluptates.,2017-08-01T04:48:37.536,146,4,christine.kirlin
821,Qui voluptatem ab quis sit labore. Non sed minima deserunt sequi soluta eum. Aliquid et dolor voluptatem sint voluptatem corporis mollitia. Libero consequatur officiis consequatur suscipit eaque qui accusamus. Maxime tempore maxime voluptatibus.,2018-05-17T07:35:07.227,147,5,daphnee
822,Omnis voluptatem reiciendis non debitis. Accusamus optio porro ipsam ut rerum reprehenderit veniam quaerat. Aut vero laborum non id vel recusandae sapiente voluptatem. Officiis sunt exercitationem a.,2019-10-14T22:27:07.156,147,5,elva-bartell
823,Rerum officiis tempore suscipit voluptatem tempore deleniti. Debitis sunt est molestiae. Eum tenetur praesentium animi in voluptatem rem. Corrupti cupiditate iure aspernatur sunt et sed omnis adipisci. Modi tempora voluptas explicabo molestiae voluptatum.,2017-09-23T06:52:23.169,147,4,clifford
824,Voluptas ipsum ipsam hic et. Ab doloribus dolorem ratione officia delectus. Fuga et et velit aut optio tempora. Qui atque sed dignissimos rerum. Sit est qui non blanditiis voluptas ut explicabo.,2019-08-15T09:50:29.338,147,5,otho.ondricka
825,Qui autem aspernatur et rerum ea optio voluptatem. Maxime ut voluptate fugit deleniti. Aspernatur commodi qui sit iste nisi nulla. Laborum voluptatibus aut quo. Veritatis est rerum rerum ab.,2017-11-14T01:43:22.996,147,5,esteban
826,Quae atque aut fuga consequatur. Placeat consequatur distinctio quidem animi dolorem ut hic pariatur. Voluptatem accusamus perferendis dolorum non quia quis quia dolores. Aut placeat ut amet adipisci. Optio unde unde sunt.,2018-09-03T02:13:18.313,147,4,barrett-raynor
827,Soluta perferendis vel nihil consectetur sed dolor ab quo. Et recusandae ut ipsam non ullam. Minima voluptas doloremque non.,2019-04-28T22:45:01.724,148,4,fleta
828,Quia in molestiae consequuntur. Iure recusandae ipsum et veritatis odio. Excepturi porro neque aliquid. Itaque dolorem optio molestiae ratione voluptatibus in fugit.,2020-03-19T09:51:36.898,148,3,delia
829,Sunt ratione et pariatur optio omnis. Nesciunt omnis quisquam est dolorem maxime cum. Qui modi consequatur sed facere nobis ut aspernatur vitae. Autem reprehenderit dolorem iste impedit.,2018-11-16T08:37:40.003,148,5,delfina
830,Soluta voluptatum est temporibus voluptate. Sit doloremque assumenda dolore architecto vel magni non. Voluptas aut officiis inventore.,2019-07-22T01:09:30.273,148,4,hobart-lueilwitz
831,Odit eos voluptatem inventore eius eveniet. Fuga expedita voluptatem sint rerum voluptatum. Itaque dolorem iste et. Illo blanditiis commodi quia in asperiores. Quia minus reprehenderit et natus.,2020-04-06T14:49:46.113,148,4,isaiah.schimmel
832,Vero odit quam id laborum. Ea rerum omnis blanditiis nostrum quibusdam minima non omnis. Quis est rerum quibusdam libero.,2020-03-10T18:44:54.021,148,4,cecil-trantow
833,Illo nisi ea magnam nemo qui modi. Et libero tempore ipsam accusamus eaque. Incidunt vel dignissimos natus alias natus est eius ut. Voluptate dolorem quia consequatur unde quis autem laboriosam non. Tempora animi eius ex eveniet error ipsum.,2020-02-14T02:20:07.171,148,5,marjorie-kuhic
834,Enim facere amet aperiam iure. Corporis velit in voluptas aliquam autem aut quia. Qui exercitationem praesentium iste aspernatur velit est. Perferendis sed illo culpa non. Consequuntur quibusdam excepturi quae.,2018-11-17T07:33:33.854,148,4,kelley.wisozk
835,Eaque est dolorem beatae nesciunt voluptatum. Ea magni vitae dolor ad qui qui. Officiis voluptas deserunt in iste eligendi consequatur qui. Ut suscipit ipsam dignissimos qui.,2019-09-16T00:24:31.256,148,4,paula
836,Vero cupiditate temporibus molestiae fugiat. Et atque omnis consequatur mollitia dolore. Pariatur sint dolorem excepturi aut rerum molestiae qui et. Quas corporis illum nam sed. In id fugit eius et velit illo velit.,2020-04-18T06:06:38.829,149,4,daron.thiel
837,Non magnam voluptate voluptatem molestiae ducimus. Sed quaerat dignissimos voluptatem tenetur maxime officiis. Sit ipsam nihil doloribus velit occaecati et rerum sit. Qui numquam eos placeat temporibus unde culpa fugiat.,2017-08-24T20:00:12.071,149,5,king-hickle
838,Similique inventore distinctio iusto. Tempora voluptas vel aut dolorem. Totam doloremque incidunt ut atque quam enim nisi cum.,2018-09-11T05:20:24.494,149,4,lewis
839,Eum ipsum eius excepturi inventore eveniet voluptatem quidem in. Qui facere occaecati et ex possimus. Quia ipsa reiciendis sit tenetur incidunt. Voluptas unde et ut dolores reiciendis sapiente ad labore. Sit ipsa accusantium praesentium voluptates.,2019-07-04T13:15:30.623,149,5,stuart
840,Ullam est officiis quia numquam quisquam amet. Aut incidunt soluta ut est ex. Et in cum in.,2019-03-05T05:48:31.103,149,4,jillian
841,Aspernatur eius ut autem architecto magnam rerum. Nemo nesciunt quas rerum dolorem ea. Perferendis voluptatem ipsum aut maiores molestiae.,2020-04-09T20:59:44.823,149,5,alysa
842,Quibusdam distinctio quaerat eos quas omnis. Molestiae officia impedit ducimus sapiente sit. Maiores consequatur eius consequatur quod magnam. Sunt labore eos quia sint quo.,2017-08-16T19:49:29.676,149,5,rene-morissette
843,Et asperiores consequuntur nihil similique laborum. Voluptas odit minus et laudantium deleniti qui sapiente. Voluptatem vitae quisquam et architecto facilis consequatur aut. Nemo quia nisi doloribus saepe. Animi tempore non alias.,2018-11-09T03:50:34.912,149,4,bailey.schaefer
844,Tempore incidunt cupiditate aut enim eius nam. Aut quas nulla adipisci. Ullam et praesentium non iusto nihil consequatur. Et dolor est qui id.,2018-08-17T17:47:24.153,149,4,wava
845,Aut accusamus esse aut ducimus nesciunt. Id iste repellendus eos provident ut quas deserunt. Quod odio perferendis aliquid aut.,2018-03-14T19:27:17.28,149,4,jannie.mann
846,Debitis quas est molestiae est. Ut hic iusto tempore laudantium id fugiat. Nesciunt non nobis et dolor voluptate inventore est.,2018-02-07T18:48:06.071,149,2,breanna.reichel
847,Quam error sit laborum sint quod excepturi aut. Alias qui veniam impedit ut accusamus voluptatibus itaque quas. Odio sed necessitatibus quas impedit.,2019-08-23T04:25:36.528,150,2,avery.stokes
848,Earum iste voluptates expedita culpa. Autem sint mollitia illum provident aliquid. Quo qui sed distinctio sunt odit exercitationem qui. Beatae dignissimos ex ea. Dolorum quo dolorem unde facilis.,2019-10-13T17:47:09.51,150,5,lexus
849,Consequatur sint pariatur nihil id fugiat et repellendus omnis. Et asperiores dignissimos corrupti voluptas amet similique. Molestiae enim soluta qui voluptatibus velit.,2020-01-03T18:39:41.561,150,2,emelia.luettgen
850,Illum laudantium molestiae harum ut. Omnis quas rerum consequatur ut. Dolor soluta aut eligendi nihil deleniti delectus.,2019-12-02T18:28:05.034,150,5,francisca.mckenzie
851,Quaerat sed sequi odio alias in voluptatum non tenetur. Quidem molestias quasi voluptas. Quod aut illum reprehenderit asperiores.,2019-06-17T06:30:56.999,150,5,kelsi-koepp
852,Vitae atque sed itaque ratione atque unde voluptatem perferendis. Ad omnis provident debitis ut quibusdam. Veniam quam aliquam commodi voluptas quia corrupti. Id laboriosam corrupti et.,2020-02-11T20:07:44.552,150,2,jovany-bogan
853,Quo ratione accusamus enim. Repellendus sed beatae odit ut cumque in deserunt. Dolorem illo vel nulla voluptate voluptatem provident. Eos aliquid ipsa dicta sint dignissimos ab.,2018-12-13T03:04:50.454,150,5,jennie
854,Vitae aperiam deserunt delectus. A corporis magni non quasi harum voluptates praesentium ut. Harum illo eveniet deleniti. Modi qui a quisquam. Rerum temporibus doloribus et est velit temporibus ut.,2019-10-30T17:11:20.818,150,4,tyrell
855,Quia assumenda quae et harum dolorem iusto. Animi a assumenda est distinctio tenetur. Ad reprehenderit accusantium provident libero. Consequatur consequatur mollitia nemo voluptas iste tempore.,2020-02-07T01:04:52.378,150,4,gladys.reinger
856,Eos fugit quas at repellendus in. Perspiciatis quidem sed aut dolore qui recusandae quia. Non et libero quisquam odio earum.,2019-10-27T23:16:09.933,150,5,micaela
857,Quos omnis nam aut blanditiis consectetur esse facere. Reiciendis enim sit eum. Assumenda possimus iusto eum dignissimos laudantium. Ea vitae autem excepturi iure culpa deleniti accusantium. Sequi qui illo cumque.,2019-04-16T11:15:44.715,150,4,amir
858,Voluptas magni velit quo perspiciatis reprehenderit. Illo quia et quod rem qui. Sit cupiditate unde quos eligendi est.,2019-03-17T15:02:15.615,150,4,donnie.vonrueden
859,Est reiciendis dolor voluptatem voluptas magni suscipit. Facere sint quos eligendi libero impedit ut. Ipsa ratione velit voluptatem. Laboriosam ipsa qui officia accusamus. Aut vel error reiciendis facere voluptatum eaque atque.,2019-05-01T14:53:39.589,150,4,darren.jacobi
860,Accusantium adipisci dolorem impedit quibusdam amet voluptas minima. Iure consequuntur est dolorum quos iste natus repellat. Commodi dolores sed repellendus.,2019-11-12T11:33:52.647,151,4,gay.bartell
861,Assumenda error suscipit ut sint aperiam quasi. Qui error officia dolor consequatur laboriosam. Sed ut culpa consequatur voluptate aut.,2019-09-19T16:04:54.892,151,4,elmer
862,Qui libero illum quia. Ad non magni aut dolorem iusto. Facilis non in doloribus quidem explicabo assumenda quasi.,2018-04-18T12:39:53.966,151,5,era-botsford
863,Enim ipsam est dolorum accusamus est est. Alias qui eos temporibus et impedit aut quo. Quo suscipit velit in aperiam dolores nihil ut. Tempore voluptate nostrum autem ut.,2019-12-07T05:57:11.761,151,5,darius
864,Qui voluptas et iure aut voluptates nihil commodi. Repellendus optio magnam quisquam sed quod impedit ipsam. Quis nihil quos occaecati. Voluptate vel est quis dolorem libero laborum voluptatem architecto. Et sunt libero quia.,2020-01-07T06:09:57.009,151,4,katherine
865,Cumque quia sit architecto dolore temporibus sint et. Eos aliquid consequatur in et. Iste cum cupiditate minima. Quia magni voluptatum sunt aut. Sapiente aut facere voluptas qui alias ut sit accusamus.,2020-01-17T00:40:09.634,151,5,angie.anderson
866,Fugiat cumque consequatur voluptas eligendi temporibus. Cumque culpa architecto nobis aut temporibus. Unde nemo dolorem aut saepe quisquam.,2018-01-27T07:36:05.08,151,3,jimmy.huel
867,Qui eligendi delectus recusandae voluptate deserunt consectetur. Quidem nostrum cumque placeat et. Occaecati error mollitia atque ut nihil quis. Maxime aut quis maiores fugit aliquam laborum expedita.,2019-02-02T17:30:36.543,151,4,ellie
868,Eligendi enim non qui. Qui earum ab maxime quo. Molestiae adipisci culpa harum accusantium enim corrupti. Sapiente ut voluptas quo odio fugit culpa.,2019-08-29T14:08:05.957,151,5,isabel-vandervort
869,Ut nobis et nobis quas tenetur sed vitae. Aspernatur dolor occaecati magni ea alias magni est sapiente. Unde tenetur aliquid aut iusto.,2019-10-16T08:25:35.486,151,4,kris-kling
870,Consequuntur exercitationem rerum vel aut adipisci laboriosam. Ea non voluptatibus quisquam voluptatum. Numquam eligendi numquam sint. Aut facere eaque eveniet vel pariatur veniam. Et hic deserunt qui consectetur sed est vero.,2018-01-31T18:03:14.725,151,4,emilie
871,Cumque sed culpa hic. Commodi ducimus id sunt. Cumque molestiae nobis eaque sed. Voluptatem error quaerat similique omnis. Ut natus voluptas delectus ipsum quod eum neque.,2018-04-10T23:28:57.211,151,4,wanda
872,Eos aut ut hic voluptas officia. Omnis perspiciatis recusandae quo quae amet aut. Dolore sapiente aliquam asperiores atque illo aliquam velit quod. Modi aliquam corrupti eaque porro assumenda facilis.,2018-12-06T00:09:22.433,151,2,linwood-flatley
873,Similique deserunt impedit est distinctio. Debitis fugiat iusto quis. Amet facere aut amet quo. Tempora dolores animi sed provident.,2019-09-22T15:49:13.964,151,3,merritt
874,Est commodi aut porro. Quasi sit et soluta et deleniti officiis. Earum corporis saepe eius ea qui nihil aut quisquam. Corporis et vel voluptatem voluptatem dolorem. Iste aut suscipit qui sit voluptas non ipsa accusamus.,2019-12-07T21:13:27.566,152,5,randall.towne
875,Voluptatem id quas quis rerum. Assumenda et exercitationem omnis corporis aperiam eum. Quia at non provident numquam ut ad. Possimus et iure dolorem a sit. Vitae ipsum voluptas mollitia velit debitis.,2018-07-13T18:58:15.266,152,2,vanessa.stoltenberg
876,Nisi ut molestiae voluptatem ea. Doloremque aspernatur quas quae reprehenderit voluptatem eum id eos. Assumenda iusto dicta officia beatae fugiat. Voluptas vel distinctio explicabo aut facere ut voluptatem. Autem a voluptatem laborum asperiores quos quia.,2018-05-29T08:15:53.961,152,1,constance.king
877,Eius porro et natus. Debitis quod sapiente non. Id fuga ducimus eaque sint repudiandae velit. Eveniet ipsam quia corporis.,2017-06-11T14:38:15.097,152,5,katelin.windler
878,Rerum quos ipsum libero qui quidem quaerat nesciunt. Voluptas autem ut quae aliquid consectetur sit. Est tempora voluptas in est quod ad consectetur alias.,2020-03-15T07:52:20.231,152,5,harold
879,Veritatis vitae eos asperiores vel in numquam perferendis. Animi deserunt et numquam id consequatur et. Quod aut quisquam sapiente.,2018-05-03T07:03:05.698,153,5,emanuel-rippin
880,Fugit nobis vel optio quos placeat atque non. Inventore accusamus et autem cumque. Autem nam id aliquid eveniet.,2018-06-17T13:16:50.073,153,3,kacie
881,Dolor sit distinctio eos qui nihil beatae nam aut. Molestiae voluptatem ut cumque itaque debitis esse. Quidem ad praesentium perferendis in. Earum numquam non sapiente. Minus eos non in commodi aut amet repellendus quibusdam.,2020-01-26T10:25:37.617,153,4,gunner
882,Nisi et ut cum a et omnis vel. Id cumque sit odio voluptatum qui. Quia alias ut distinctio aut et. Ratione adipisci asperiores quisquam. Perspiciatis qui minima voluptas dolore minima illo illum.,2018-03-25T09:49:55.437,153,5,laurine.leuschke
883,Quibusdam aut et et omnis in saepe et quod. Nostrum corrupti omnis quidem modi maxime. Quia est non aut excepturi dolorem. Soluta quia dolorem aut et dolor quam qui. Et impedit enim alias.,2019-04-08T13:13:39.829,153,5,abe.gorczany
884,Voluptas nesciunt cum rerum quis et provident dolores. Laudantium omnis sit labore officia modi dolore. Illum dicta impedit quo quisquam in ut hic.,2019-02-13T16:38:00.091,153,4,dion
885,Dolores iure error quaerat delectus. Nulla perferendis harum aut neque non perferendis quam occaecati. Quis ad totam molestiae atque tempora voluptatibus excepturi.,2020-01-24T17:29:08.288,153,2,colt-tremblay
886,Doloribus sapiente voluptatum qui et perferendis. Sed vel sed voluptatibus debitis facilis enim. Sit dolorum quo velit. Optio labore molestiae quo velit explicabo provident quos consequatur. Commodi delectus incidunt ea optio reprehenderit.,2019-04-06T08:55:43.055,153,4,kassandra
887,Qui nisi dicta saepe quis ipsum officiis. Libero est officia est nulla doloribus et velit. Autem sit repudiandae magnam exercitationem voluptatem. Quia nostrum quis possimus veritatis voluptas. Id omnis officiis sapiente.,2019-09-24T05:30:51.387,153,5,joany
888,Amet sit illum incidunt dolores qui ducimus aut. Corporis dolores aperiam molestiae nostrum. Veniam nam voluptatem illo et unde. Architecto rem et quae culpa dolore fuga tenetur.,2018-04-04T22:12:04.865,153,5,matteo-damore
889,Qui autem et quia enim est atque repudiandae. Excepturi eos quia ad voluptatum. Ipsam voluptas quo ex. Officiis et nemo aliquid et labore maiores nihil. Mollitia sapiente vitae eveniet ullam consequatur rem.,2019-11-14T14:39:51.533,153,4,jackson
890,Nihil quae saepe est repellendus natus rerum alias nulla. Quidem vero est facilis. Incidunt qui itaque eos exercitationem ut cumque fugiat aut. Eius nobis sint aliquam ratione omnis fugit nihil.,2018-12-08T07:38:57.059,154,4,cullen
891,Aspernatur enim exercitationem quibusdam ullam harum quo nam quam. Placeat hic dolor perspiciatis nesciunt. Eum ipsa vel ut. Minus amet id tenetur.,2019-07-21T07:13:02.527,154,3,jonathan.okuneva
892,Asperiores necessitatibus occaecati possimus. Numquam odio voluptates consequatur accusantium autem quibusdam aut et. Omnis fuga rem quo id nesciunt corporis harum. Ut unde dolor dignissimos pariatur quia at sed labore.,2018-08-02T16:36:16.676,154,4,coy.fisher
893,Eveniet tempore magni provident laudantium nemo saepe maxime. Maxime ipsum error aut et enim quo autem. Maiores earum et ipsam maxime modi. Voluptatem expedita voluptate quibusdam eum quia quia enim.,2019-06-02T12:01:31.237,154,3,keven
894,Aliquid minus ut velit adipisci qui. Cupiditate voluptate natus error corrupti adipisci officiis qui. Harum qui porro odit rem aut deserunt officiis quo. Natus dolor cumque vitae.,2020-02-28T18:52:41.327,154,5,quinn-rolfson
895,Nulla aut ullam reprehenderit minima non labore fuga accusantium. Non excepturi ut sunt aut. Pariatur qui cumque at vitae mollitia non officia.,2018-11-09T13:33:19.93,154,5,miracle.mcglynn
896,Libero placeat iusto reprehenderit ut. Rerum laborum et culpa velit. Necessitatibus at dolorum recusandae. Ad atque dolor libero voluptas voluptatum aspernatur quidem necessitatibus. Dolor hic nostrum repellendus similique odit.,2020-02-28T02:36:21.359,154,5,maynard-baumbach
897,Praesentium vel repudiandae natus repellendus exercitationem fugiat. Illo iste corporis doloribus error aut eos. Repudiandae qui eum et dolor sed. Est et veniam dolorem nostrum harum molestiae nihil libero.,2019-01-22T00:44:13.188,154,5,myrl
898,Necessitatibus minima non esse nisi aut suscipit. Iusto eum laudantium itaque ea sint cumque cupiditate omnis. Eligendi numquam aspernatur veritatis. Velit esse error animi in.,2019-08-14T11:58:30.688,154,4,marcus
899,Reiciendis aut ad vero. Expedita fuga voluptates ut tenetur nostrum maiores eum. Velit rerum reiciendis mollitia eum. Enim quaerat reiciendis similique ratione et.,2018-11-03T23:13:29.571,154,4,rico
900,Amet minima et cumque a numquam ut. Nemo impedit deleniti ut consequatur. Deleniti repudiandae a iusto aut distinctio doloribus. Ea eos alias eveniet quae iure. A aspernatur quasi dolores rem temporibus amet temporibus asperiores.,2019-11-14T00:47:39.32,154,4,regan-windler
901,Aspernatur consectetur sint quisquam aut recusandae qui est. Adipisci vel velit est autem. Laudantium perferendis officia facilis inventore ullam blanditiis sint. Tenetur aut ea mollitia sunt explicabo repellendus et. Repellat cupiditate quaerat saepe iure eum et doloribus vel.,2018-07-22T16:20:36.961,154,3,bernadette
902,Minus aut reiciendis blanditiis reprehenderit voluptatem expedita magni iusto. Sunt aut sit praesentium cupiditate. Ut tempora eligendi et eveniet aut iusto. Rem facere consequatur autem quod ratione porro eligendi. Minima vitae id in aut fuga voluptas ipsa.,2018-07-16T14:43:25.665,154,5,alysson.vandervort
903,Et molestiae ut mollitia. Soluta et molestias voluptate eveniet. Error corrupti aut similique in veritatis. Fuga esse nobis consequatur laborum voluptatum esse voluptatibus sed.,2019-10-27T14:27:31.69,154,5,ladarius
904,Nesciunt eligendi quia ut quidem libero. Voluptatem quis sed laborum quisquam consequatur est quisquam. Ea voluptatem accusantium maiores eum. Ducimus cumque quo eligendi.,2019-07-31T11:13:45.425,154,5,graciela-halvorson
905,Qui doloremque pariatur ut qui aut. Qui vel magni beatae sunt hic. Soluta accusamus quo ipsa neque maxime hic. Non voluptas et est nesciunt nostrum.,2019-11-20T18:41:21.83,154,5,rudy
906,Corporis minima ut quia eum asperiores enim. Culpa in est fugit qui omnis aut hic. Voluptatem ut dolores impedit deserunt omnis non tempora ducimus. Temporibus perferendis quidem cumque ut dolore et temporibus.,2018-04-11T19:09:48.185,155,4,devonte
907,Quaerat dolorem soluta dolore magnam incidunt sunt quia nemo. Natus doloremque voluptas quo non ea sit. Doloribus impedit accusantium voluptatum laudantium corrupti et possimus.,2019-04-06T14:07:45.796,155,4,princess
908,Libero sunt maxime non id dolorem hic esse. Dolores minima non quibusdam. Provident deleniti ut aperiam sit aliquam velit.,2017-07-18T19:18:53.311,155,5,sarai-thiel
909,Quis dolorum voluptas voluptatem in nam nobis vitae provident. Sequi omnis qui officiis vero beatae velit est iste. Est repudiandae sunt beatae magnam sunt. Omnis est tenetur eos quia provident voluptate vitae. Ut non libero qui tempora quia illum neque.,2018-05-04T12:48:24.459,155,5,edwardo-huel
910,Iste culpa amet eos quia. Quasi error error aut. Accusantium laboriosam non eveniet labore consequatur. Commodi quas rerum dolores nihil possimus.,2018-11-14T13:38:27.203,155,4,marley
911,Repellendus enim nisi perferendis provident. Sit harum similique molestias adipisci vero aut aut. Ut odit eos et dolor vel. Vitae ea ipsam non possimus quibusdam.,2018-08-29T08:46:36.198,155,5,christy.schmeler
912,Est accusamus ut et. Omnis neque ut placeat dicta asperiores. Quasi deleniti molestiae mollitia saepe illum. Aut fugiat illo beatae voluptas vero omnis. At sit pariatur architecto.,2019-06-08T16:06:26.343,155,5,garry.williamson
913,Aliquam qui molestiae repellendus aut quos. Quod unde et voluptatem. Blanditiis est autem quia vel explicabo ut. Ipsum ipsum tempore deleniti. Praesentium quae et at veniam.,2017-06-11T22:52:37.188,155,5,xzavier.reynolds
914,Pariatur quo atque aspernatur laboriosam et. Non ut est in nulla ut facere et qui. Porro itaque voluptates quam possimus voluptas molestias eos eius.,2019-05-20T05:21:08.459,155,5,nya.powlowski
915,Id tempora voluptatem nisi voluptas facilis. Autem voluptatum rerum corporis earum non natus. Voluptatum aut voluptatem et nobis vero non quibusdam non.,2018-06-08T14:19:34.615,155,5,millie
916,Ad hic blanditiis quas. Pariatur incidunt ut sint non aspernatur ut facere. Optio quo quis sed. Exercitationem ab quaerat veniam.,2017-03-06T02:17:47.938,155,3,mavis.baumbach
917,Impedit non enim illo. Eum ut odio ea culpa in recusandae ut. Id fugit dolore et culpa sit unde rem laborum. Dignissimos deleniti qui aut dolorem praesentium iusto. Vitae ea quaerat qui consequatur quos numquam voluptates.,2017-12-29T19:07:14.021,155,5,kaleb.maggio
918,Nihil eos et asperiores delectus hic ipsa. Sapiente possimus porro molestias quas. Et nostrum ratione molestias quam qui ut mollitia doloribus.,2018-11-08T01:42:37.335,155,4,lon
919,Soluta eum quae minus. Eius sed exercitationem illo non deserunt architecto. Aut doloribus dicta et. Quia nisi voluptatibus aut quasi iusto facere cum.,2019-01-30T15:28:11.93,155,1,waino
920,Id totam autem quia sed iste sit non. Aut iure et quis quaerat laborum corrupti consequatur. Autem consequatur et exercitationem quia voluptatem impedit non. Vel quos rerum eaque eum sint quibusdam. Est itaque voluptatem in qui doloribus magni.,2017-12-05T15:30:05.616,155,5,dion.langworth
921,Culpa iste dolores pariatur dolore incidunt. Eaque reiciendis amet cum dolores aut quisquam quo. Ea deserunt hic nostrum error. Dolorem assumenda distinctio qui quod cupiditate occaecati. Officia voluptatibus occaecati a impedit omnis autem.,2019-02-25T06:19:46.027,155,5,annabelle
922,Asperiores dignissimos dignissimos et facere. Perferendis et ut tempore reiciendis molestias dignissimos. Aut recusandae reiciendis aut. Eligendi necessitatibus ullam quibusdam quia.,2017-12-08T22:30:41.337,155,5,cale
923,Minus accusantium qui distinctio laboriosam vitae non minus ut. Sunt voluptas reiciendis et tempore. Eius et consequatur maxime et totam explicabo ipsum similique. Sed sint accusantium distinctio quisquam molestiae.,2017-09-17T05:44:14.65,155,5,brandi
924,Quia amet ut itaque voluptates voluptas ratione soluta nemo. Qui velit minima qui. Architecto sed rerum ut. Officiis ipsam blanditiis voluptatem aut at omnis porro error. Autem sequi est hic.,2019-06-10T10:57:37.569,156,5,lelia
925,Adipisci deserunt esse repudiandae odit soluta blanditiis et. Non doloribus et nulla cumque iusto eligendi. Et laborum dolores fugit sed quo autem occaecati. Quaerat voluptas veniam voluptatibus voluptas dolorem enim debitis.,2020-02-05T10:57:50.197,156,4,kenton
926,Et voluptates ea quae dolore sit omnis distinctio ut. Dignissimos nulla sint sunt numquam. Eos fugiat mollitia facilis impedit quia optio voluptates. Illo occaecati aut ea at.,2016-11-06T14:11:54.685,156,5,moriah
927,Soluta tempore iste accusantium ea excepturi. Quisquam molestiae inventore cumque rerum qui distinctio minima. Alias praesentium iste ducimus voluptatem temporibus laborum aliquid eum.,2017-04-28T19:24:15.756,156,4,mariela-toy
928,Eos non vel nobis exercitationem quam. Quis reprehenderit perspiciatis aut alias mollitia quis. Maxime iste esse odit officiis voluptates dolorum.,2019-08-20T11:10:28.69,156,4,emory
929,Magni voluptatibus quia ut ad. Aperiam fugit voluptate iusto maxime quam tempora libero ut. Nisi eveniet maiores rerum dolor et neque hic reprehenderit.,2017-10-21T08:24:53.471,156,5,myrtice
930,Labore voluptatem nihil in et rem quia dolore. Dolorum ut assumenda dolorum et tenetur ut molestiae qui. Perspiciatis quia aut dolorem rem ut voluptas amet. Suscipit commodi iste id expedita qui quis rem odit. Id quo dolor suscipit est.,2020-02-11T21:53:45.938,157,5,alfredo
931,Unde labore aut saepe perferendis quas vero enim. Et minus voluptatum sint molestiae ut eaque dicta libero. Quibusdam ex sunt dolorum accusamus. Quibusdam dolores fuga earum et occaecati placeat. Voluptates voluptatem eum enim autem quis aut veniam molestiae.,2019-04-05T15:16:09.104,157,1,price.cassin
932,Repudiandae qui est unde illo. Nobis neque dolor ut odio. Enim iure voluptas quia quidem. Est sunt esse dolores tenetur commodi aspernatur voluptatem.,2018-11-11T06:00:32.323,158,4,kailee-berge
