ID,Body,Created At,Product ID,Rating,Reviewer
241,Nesciunt qui vel voluptate repellendus sunt consequuntur voluptatem ut. A quo quia omnis laudantium enim et. Aut nobis culpa iusto perspiciatis. Aperiam sit illum enim odio perspiciatis consequuntur odio sit. Maiores qui molestias doloremque et minus.,2017-08-04T23:33:23.001,45,4,lincoln.corkery
242,Et voluptate ut magnam aspernatur. Cupiditate a eos nihil harum distinctio voluptatem qui quasi. Laborum aut nostrum rem odit.,2016-06-06T08:07:04.209,45,3,jewell
243,Odio ullam voluptas quas neque vel eum. Autem voluptatum magni dignissimos rerum quos labore. Voluptatem facilis odit est.,2016-12-17T02:39:08.938,45,4,evert-prohaska
244,Facere vero doloribus aperiam inventore consectetur eum. Rerum fugit laudantium voluptates consequatur qui. Consectetur molestiae deleniti velit quasi enim ut nobis. Est veritatis autem ea distinctio laborum facilis. Voluptas et quas labore sapiente minima inventore omnis.,2016-10-24T12:03:04.282,46,4,germaine.littel
245,Et ut deleniti perferendis. Iste doloribus illo quis reprehenderit assumenda quo. Est quos voluptatibus ipsam. Maiores excepturi deserunt et ut praesentium aliquam est quidem. Tempora nam nulla laborum id.,2017-04-14T12:37:20.341,46,4,joel.hartmann
246,Dolorem atque aut in id explicabo nulla nesciunt. Laudantium aliquam aut iusto consequuntur voluptas et adipisci quia. Unde reiciendis voluptatem ab. Cumque qui quis iste aut architecto. Harum explicabo nihil impedit cupiditate aut dolor eveniet.,2018-07-19T05:29:29.839,46,4,rylee-wisozk
247,Placeat rerum aut omnis excepturi quos sapiente ea. Optio velit voluptatum numquam eum distinctio ea dolores. Voluptatem at et sit pariatur voluptatem. Est libero autem architecto expedita expedita aut.,2019-05-23T09:43:54.997,46,4,zetta
248,Non qui exercitationem iure aperiam aliquid qui aut. At velit velit exercitationem rem deserunt et sunt. Repellat perspiciatis porro sit quia.,2019-04-10T03:16:07.74,47,4,shakira.considine
249,Qui suscipit natus vel eum vel recusandae. Natus perspiciatis dolorem libero ipsum nostrum. Reiciendis ipsa voluptatem quasi tempora voluptate.,2019-05-17T18:56:18.495,47,4,lillie.kub
250,Voluptatem voluptatem odio aut voluptatem. Velit inventore eveniet rerum adipisci et blanditiis illum. Blanditiis iure veritatis beatae enim. Sapiente quia corporis et quaerat enim.,2018-03-01T18:04:50.665,47,5,kristy.bernier
251,Quia magnam eum adipisci voluptatem. Eveniet animi enim id vitae sunt ex. Sit beatae qui voluptatem sit vero.,2019-09-01T04:14:41.528,47,4,rafael
252,Sunt quia quis vel sit sit neque nihil. Natus voluptas hic sit veniam. Expedita tempore aut vel ullam impedit est. Vitae impedit ut qui dicta omnis dolorem quia.,2019-05-29T06:11:56.534,47,5,pat
253,Quisquam autem quisquam neque odit odio et expedita. Accusantium ea praesentium nostrum odio qui. Aliquam aut sint sit eveniet quae voluptas suscipit blanditiis.,2018-02-19T18:37:30.157,47,4,ciara
254,Est blanditiis et aut vitae. Neque autem voluptatum voluptas ut quis dignissimos aut nobis. Est deserunt aut quae quisquam impedit voluptates. Possimus et quos aspernatur aut sapiente.,2018-09-23T00:44:35.501,47,4,dean
255,Voluptatem deserunt ut sint magni necessitatibus ex non ut. Ipsum soluta sint veritatis. Modi accusamus illum aut rerum voluptatem sed quis. Eius sed quis voluptas quis et maiores laborum.,2018-11-11T10:37:45.058,48,5,obie
256,Aliquam sit voluptatem aliquid totam voluptates. Laudantium cupiditate molestias vitae. Beatae odio et sint. Adipisci sint laboriosam rerum eveniet voluptatibus illum.,2019-11-17T05:32:04.524,48,4,thurman-grady
257,Et voluptatem temporibus sed ut. Soluta quis magnam nemo. Dolores dolorem nisi est ad velit. Quo sequi non dolorem nam ab omnis ipsam. Enim enim pariatur recusandae accusamus.,2019-10-31T04:06:03.816,48,2,shyanne
258,Eligendi autem consequatur commodi. Accusamus omnis illo commodi. Repellendus ad minima dolore pariatur at.,2019-07-20T20:44:07.311,48,1,isabelle-rowe
259,Tenetur aut provident ullam voluptatem vel. Sit delectus aut rem magnam voluptatum et quos. Quaerat ratione aspernatur quia sint.,2019-10-16T07:52:12.842,48,5,tomas
260,Dolores est atque dolores quis qui. Quas velit provident blanditiis laudantium reprehenderit repellendus. Nesciunt doloribus quo delectus voluptas ea repellat. Dolor accusantium ipsum est.,2019-05-15T13:25:23.778,48,4,heidi
261,Impedit impedit aspernatur fugiat quos. Molestiae excepturi praesentium voluptatem perspiciatis ut nobis ut enim. Qui eveniet neque aliquam dolorem quod harum libero dolores. Quisquam ut eum dignissimos libero est voluptatibus. Vero magnam facere qui cum.,2018-04-17T18:28:27.369,48,5,carlo.labadie
262,Sit iste sed aspernatur consequatur dolor. Culpa delectus facere ut eos vel tenetur quam. Eveniet sit reiciendis est adipisci laboriosam. Enim corporis non maiores quae non totam. Aut voluptatem asperiores mollitia qui sit explicabo aut qui.,2018-05-02T02:54:48.572,48,5,gerardo
263,Nesciunt voluptatem ullam magni. Quae ea iste reprehenderit et suscipit quia ut explicabo. Omnis consequatur laborum provident sapiente sit aliquid facilis.,2019-09-25T22:03:57.423,48,4,allene-feest
264,Maxime voluptatibus doloremque cum. Velit et quo asperiores sit sunt doloremque. Natus ut eligendi laboriosam minima quas animi.,2018-02-25T04:04:13.268,48,2,ansley
265,Deleniti possimus vero sint. Nesciunt natus vel repellendus officia assumenda. Rerum omnis quibusdam quidem veniam eos id. Aut quisquam alias dolorem expedita voluptatem in magnam.,2019-03-20T02:43:04.826,48,2,delmer.tremblay
266,Totam unde eius odio. Doloribus sed dolor incidunt iste consequatur. Adipisci id laborum eum. Cumque id magni numquam.,2020-03-17T05:38:56.175,48,1,edythe
267,Voluptatem illum quasi eum id voluptates. Aut vel expedita distinctio corporis sed ipsa. Sed voluptatibus facere fuga quia. Deleniti qui inventore quos sed.,2018-02-03T03:53:29.947,49,4,adonis
268,Natus sequi dolorem omnis cumque eum laudantium aut. Quo eius voluptatem nobis doloremque harum nobis quaerat. Inventore ut sapiente dolores sed reiciendis ut aut asperiores. Neque est quisquam dolores hic ratione repellat.,2018-02-18T14:41:26.671,49,2,alex
269,Distinctio est ut ipsum quo. Quisquam illo eveniet aut laborum veniam. Quo id quo ut consequatur. Vel dolores commodi incidunt sapiente maxime.,2018-08-28T11:08:17.245,49,5,wiley.bahringer
270,In praesentium cupiditate ex velit nemo. Et nostrum aspernatur suscipit. Praesentium exercitationem id at nihil.,2017-11-04T09:46:30.94,49,4,antone.dooley
271,Nam et modi recusandae recusandae soluta in accusantium. Et ea placeat tempore cumque dolorem aperiam eligendi est. Omnis mollitia delectus illum commodi.,2019-09-25T11:18:56.286,49,2,ariel-rolfson
272,Ullam ducimus modi quam nisi rem autem. Molestias ut unde est sunt soluta dolor quis. Non quos vel laborum velit similique voluptate.,2018-12-30T14:55:45.636,49,5,dewitt
273,Suscipit qui vero voluptas aut culpa. Magni aliquid fugit repellendus illum doloribus occaecati aspernatur. Sint error ut vel.,2019-06-10T08:25:33.637,49,4,hassie.dibbert
274,Possimus maxime laboriosam animi ipsa non sapiente voluptatem adipisci. Impedit modi voluptatem dolor ex deleniti sed. Doloribus omnis in eius eos.,2020-01-21T01:02:34.656,49,4,alize
275,Corporis itaque impedit eligendi nemo aut adipisci et quasi. Est vero est enim placeat iure. Fuga inventore mollitia numquam sed dolorem.,2019-09-20T19:47:31.524,49,4,jaden
276,Officiis optio quasi placeat aliquam excepturi illo dignissimos. Esse veritatis vitae voluptate veniam. Quia dolorem repudiandae magni enim corporis quidem eum. Sit et laboriosam excepturi. Similique sed quae consequatur.,2017-11-29T14:00:56.186,49,4,bobby.hartmann
277,Repellendus quibusdam aperiam occaecati dignissimos consequatur mollitia unde. Et libero vitae est vel. Molestiae cupiditate omnis deleniti sit ea nisi. Quia quos dolorum quaerat dolorem earum.,2017-10-03T10:52:53.129,49,4,thora.cruickshank
278,Similique ratione odio illum. Placeat autem vitae nam voluptas odio voluptatem dolores et. Quis consequatur alias sit est.,2018-06-22T16:38:28.153,50,3,destini-zboncak
279,Et ea rerum voluptatem. Blanditiis non est omnis. Quos sunt aperiam sed et nesciunt temporibus eum. Aut autem tempore nobis et hic mollitia hic. Eaque blanditiis ab voluptas.,2019-02-28T18:30:47.797,50,4,hillard
280,Veniam dolores nobis ullam sequi ratione ducimus. Aspernatur aut tenetur sed rem ipsum dolore in. Quod quia facilis a in vel et voluptatem nesciunt. Natus distinctio corporis quia rerum voluptatibus officia consequatur.,2018-11-20T06:25:18.819,50,5,ned
281,Explicabo voluptas nemo enim. Rerum odit voluptatem voluptas eum. Quos sed est fugiat rem omnis vel accusamus.,2018-07-05T08:37:25.807,50,4,enrique.adams
282,Aut voluptate recusandae ducimus. Possimus et distinctio expedita cumque quas minima. Rerum deleniti iure nesciunt adipisci id pariatur harum. Harum aperiam omnis eos odit quis asperiores ea dolorem.,2019-10-07T13:43:01.67,50,5,letitia
283,Voluptatibus molestiae provident dicta earum dolor cumque recusandae. Aut aut est velit. Vitae soluta et molestiae nihil magni non ipsa. Est sequi repudiandae praesentium fugit quod et est dolorem. Amet suscipit quis voluptatem.,2018-08-04T08:10:39.816,50,4,ulises-flatley
284,Mollitia earum quas voluptas error dolor. Molestiae quisquam qui eligendi. Modi adipisci animi excepturi sit voluptas. Nesciunt eos dolorem aliquam natus quibusdam.,2019-05-02T15:23:17.299,50,4,vicenta
285,Sed autem quos vitae. Eaque totam voluptas consequuntur eaque ut vel a. Dolore nostrum iure voluptatem quo maiores sint quidem. Sunt pariatur occaecati exercitationem voluptatem. Consequatur sit eius culpa voluptas molestiae ducimus.,2018-01-13T11:53:14.08,51,5,rhea
286,Voluptas repellat similique occaecati maiores et repellendus maxime sint. Quaerat voluptatem veritatis eveniet quidem. Molestias et rerum molestiae. Voluptas quasi quia beatae voluptatem voluptatum enim sunt nesciunt. Cum ipsam dolore distinctio molestiae dolores qui ut.,2017-06-10T20:56:22.035,51,4,paul-frami
287,Minima voluptas et totam. Porro ea repellendus nisi quod provident. Doloremque et eaque placeat nihil quia et qui et. Cupiditate excepturi iusto labore et. Sint necessitatibus tempora molestiae alias ut aperiam veritatis sequi.,2018-01-16T16:10:33.522,51,2,alexandria.gutkowski
288,Omnis deleniti cupiditate aperiam illo. Iste ratione at dolorum. Qui minima officia architecto eius labore. Voluptas vel aut incidunt voluptas et iste accusamus.,2016-09-17T15:23:54.628,51,4,darby-trantow
289,Sit quia excepturi est dolor qui. Sint sed sequi voluptatibus eos consequuntur. Quisquam aperiam voluptatem rem quibusdam eveniet et incidunt exercitationem.,2018-06-28T21:43:15.546,52,4,sabryna-stark
290,Quas culpa voluptatem quis officia consequatur ullam. Iste et explicabo dignissimos qui dolor rerum. Neque facere non est natus. Doloremque reprehenderit ipsum dolores quo a.,2019-05-30T12:54:19.428,52,5,marshall
291,Veritatis numquam qui sapiente. Id dolores iste molestiae ducimus repudiandae eos voluptas. Similique eos voluptatem saepe nemo rerum consequatur voluptatem autem. Est quos quia rem illo fuga.,2019-11-30T03:38:11.173,52,5,miguel
292,Consequatur non reiciendis quisquam. Quae quia odit aperiam impedit dolores pariatur doloremque. Architecto quis et debitis qui consequatur ex.,2019-03-30T09:30:43.588,52,4,vivian.weissnat
293,Saepe voluptatem dolor voluptatem et rerum quaerat laboriosam consectetur. Magnam quis autem vero est architecto minus. Dolor deleniti a architecto. Cum ipsum adipisci modi eum ut. Veniam velit et cum consequatur voluptas.,2018-12-20T08:44:30.122,52,4,beaulah-graham
294,Rem numquam fuga fugit saepe tenetur ut. Nihil molestiae quisquam accusantium tempore dolor. Dolorem recusandae eum velit architecto rem animi blanditiis. Voluptates provident ut iusto.,2018-05-23T10:22:35.169,53,4,barry
295,Neque nisi blanditiis dolor repudiandae nostrum architecto. Est ut doloremque nobis molestiae nobis. Quam tenetur porro quis.,2018-05-11T21:10:25.872,53,4,lonzo.kunze
296,Consectetur sint ut repudiandae. Adipisci quis nemo reprehenderit sunt. Accusamus laudantium aliquam similique quia laudantium rem non cupiditate. Ea repellendus rem voluptatem sequi quasi. Quia numquam distinctio aut odio dicta temporibus molestiae doloribus.,2018-11-10T21:45:09.192,53,5,antonia
297,Ipsam eos cupiditate quis est dolores autem. Consequatur excepturi sed provident. Natus voluptatibus deleniti natus.,2017-06-01T10:39:14.719,53,5,jackeline-goldner
298,Nisi ab velit sed hic. Provident distinctio quidem inventore. Laborum sint voluptatibus accusantium explicabo mollitia fugiat sint in.,2019-04-12T11:07:23.078,53,4,gerardo-pfannerstill
299,Adipisci impedit dignissimos nesciunt laboriosam ut voluptatem assumenda. Ut architecto in vel officia. Et sed accusantium fugiat atque dignissimos facere. Eos soluta nostrum autem autem. Eligendi quos quasi ratione corporis aut nemo voluptas voluptatibus.,2019-09-27T09:06:22.581,54,4,alexa.leannon
300,Aut sed est labore laudantium odit minima. Commodi placeat ratione ab totam provident. Corrupti a et cum delectus ad. Facilis dignissimos id omnis ut ut.,2017-12-19T01:05:51.204,54,3,tristin-feest
301,Hic et deleniti maiores vero molestiae et et rerum. Maiores iusto quod architecto. Molestiae corporis illum enim dolor iusto esse. Dolores est sapiente et dolorem aut atque accusamus aliquid.,2018-06-15T20:40:00.344,54,3,larry
302,Eaque aspernatur non architecto qui repudiandae veniam laboriosam. Ex est distinctio aut. Ut sunt aut aliquam ut consequatur voluptatem quaerat. Mollitia perferendis quaerat exercitationem.,2019-07-03T15:24:44.683,54,4,violette
303,Labore labore molestias quia. Dignissimos aliquid excepturi totam facere et. Dolore officia sed dolorem et aliquam. Sit modi quaerat eius nemo nostrum illo blanditiis.,2018-01-08T13:52:53.191,54,5,dion-gutmann
304,Eius cupiditate voluptas eligendi sapiente laborum id. Temporibus esse iste repellat. Vitae esse pariatur veritatis rerum mollitia cupiditate. Possimus ea totam possimus doloremque et accusamus et.,2017-05-20T23:04:33.603,54,5,shyann
305,Quia voluptatem est quia dolore iste quod. Consequatur deserunt rerum debitis ullam enim tempora. Dolor quia minima ipsa occaecati nihil molestiae. Et iure sit nostrum voluptatem veritatis.,2020-02-06T12:01:50.611,54,1,kylee
306,Dolor non possimus est. Voluptas commodi laboriosam quia ut nihil autem nostrum. Totam molestiae quaerat doloremque harum aut perferendis consequatur placeat. Assumenda tempora reprehenderit autem praesentium tempore doloribus corrupti dolorem. Aperiam enim perferendis est quibusdam illum minus.,2017-03-16T07:24:13.903,54,3,caesar.rempel
307,Doloribus eum rem enim repellendus quas quis rerum. Quod pariatur minima aut voluptatem sint facilis. Itaque aut nihil dolore.,2016-12-09T23:40:29.401,54,5,vicky
308,Maxime quibusdam impedit nostrum quo. Excepturi excepturi non sed rerum dolor quo quia. Earum rerum ut animi veritatis voluptas. Dolores omnis alias dolores.,2020-01-06T12:41:13.938,56,2,greta
309,Rerum voluptatem laboriosam qui aut. Rerum ut qui soluta aperiam fuga quam vel earum. Optio alias rerum velit omnis molestiae. Eligendi quibusdam et similique.,2019-08-27T22:39:50.609,56,4,terrence
310,Non est at doloremque in minima magnam amet quibusdam. Quibusdam rerum molestiae exercitationem. Voluptatem unde qui vel voluptatum.,2019-03-07T23:19:48.043,56,5,eugenia.bernhard
311,Ipsam quaerat expedita eligendi incidunt rerum. Voluptatem autem nihil autem tempore sunt. In explicabo optio alias quia quos maxime nihil minus.,2018-05-14T09:45:53.874,56,5,laverne
312,Incidunt iusto et consequuntur facilis. Expedita aut ut minus. Repellat et qui incidunt hic assumenda rerum illo est.,2020-01-09T11:19:44.087,56,4,miller
313,Consequuntur provident quisquam voluptas nam. Esse aut laborum aut totam sit corrupti cupiditate. Iusto fugit ea temporibus et incidunt delectus error. Doloremque laudantium et quia qui.,2020-02-16T22:38:47.37,56,4,vincent
314,Adipisci odio nisi harum velit numquam numquam necessitatibus cum. Ipsam voluptatem quia nesciunt deserunt aut ea consequatur. Quisquam nesciunt veniam aspernatur at et esse.,2017-11-29T06:26:48.819,56,5,willa-tremblay
315,Occaecati veritatis iusto sunt praesentium nobis. Nesciunt non quia aperiam et. Qui nobis officiis perspiciatis magnam animi beatae.,2020-01-11T16:21:15.54,57,4,kevin.douglas
316,Ratione eius illum ut error. Sunt in nihil dolores. Minima voluptatum ut laudantium nostrum. Accusamus aliquam alias maiores esse exercitationem amet accusantium.,2019-05-21T10:28:43.272,57,4,jaron-grimes
317,Est alias qui quas pariatur. Inventore nulla rerum repudiandae voluptatem modi. Dolores consequatur ea rem nostrum distinctio rem. Id nemo saepe voluptatum suscipit occaecati voluptatum sed incidunt. Laboriosam id qui voluptatem mollitia ut voluptatem rerum nulla.,2019-03-05T07:36:33.956,57,3,talia.kreiger
318,Consequatur omnis unde velit. Odio distinctio officia expedita corrupti. Reiciendis aspernatur molestias ut quod eos mollitia sequi. Esse quaerat nam animi. Voluptas sit omnis doloremque magnam magni.,2018-06-22T01:23:44.232,57,5,aisha
319,Illum voluptate sed reprehenderit ut accusantium. Tempore vel at eaque et. Modi commodi inventore voluptatem. Rerum voluptatum quis aut.,2019-07-24T10:01:43.588,57,1,nestor-wehner
320,Corporis nam ea accusamus consectetur aut qui. Voluptas iure adipisci esse ea et non laboriosam est. Repellendus quia aut asperiores tempore aut.,2020-02-16T14:36:41.366,57,4,rosalinda
321,Assumenda perspiciatis odio ut officia tempora. Quos illo fuga culpa quam impedit doloremque placeat suscipit. Ab rerum veritatis ipsum quaerat occaecati ut.,2018-08-07T03:48:31.952,57,4,murl
322,Quia magnam velit velit quidem non sed adipisci voluptatem. Nam perspiciatis quaerat voluptates. Molestiae in neque voluptatem.,2019-08-12T15:52:13.022,57,4,vickie
323,Quia expedita exercitationem illum sequi repellat. Beatae ut quia provident quod et rerum eos. Et laboriosam vel et. Aut sequi ea et et blanditiis.,2020-01-19T08:16:27.572,57,4,adalberto-hilpert
324,Est quam saepe minus repudiandae et. Aut sed placeat molestiae alias expedita. Ea quia magni modi.,2019-10-19T17:48:32.648,57,4,alva-boyer
325,Et praesentium ut placeat voluptatem odit fuga. Quaerat laboriosam nihil et animi amet ducimus. Sed ea id nihil est.,2018-03-12T07:23:08.943,57,5,melvina-flatley
326,Provident exercitationem at velit repellat qui et. Deserunt ut inventore est. Facere voluptas est quod iste. Assumenda fugit optio molestiae optio molestiae quod quia.,2020-03-29T10:43:17.493,57,4,marguerite
327,Necessitatibus qui nam occaecati voluptatem voluptatum neque voluptatem. Culpa rerum officiis qui libero dicta voluptatem velit. Non qui occaecati ipsam facilis. Ut praesentium sed rerum magni commodi magnam magni.,2018-05-27T19:31:44.295,58,5,elliott.thiel
328,Mollitia incidunt consequatur quisquam. Et nisi consequatur consequatur ex molestias id sed. Laboriosam ipsam sequi dolor.,2019-02-17T20:15:27.559,58,5,mack
329,Modi at ipsa voluptas in. Inventore aut dolore eos. Sapiente voluptatem quia et vero odio. Fugit perspiciatis et soluta eos vel natus iste.,2018-10-19T14:30:38.835,58,4,felton-rodriguez
330,At cupiditate tempore minima. In ea est corrupti iure quia. Qui illo omnis nulla quibusdam explicabo. Qui recusandae est nihil cum et.,2018-01-14T03:26:18.966,58,5,candelario
331,Hic aliquid asperiores adipisci id cum. Ea pariatur nemo est quisquam impedit ipsam ut repudiandae. Qui eos ut et cumque est saepe cum veniam. Aliquam quae dolorem voluptas maxime. Quia eaque dolores et.,2018-01-05T01:43:13.996,58,4,jacques-lemke
332,Et vel aut dolores. Omnis consequuntur maxime officia quod eligendi fugiat cumque quia. Voluptas quis enim laboriosam eum aut beatae nobis.,2018-10-27T20:44:33.4,58,4,ima-marvin
333,Vitae est non et necessitatibus molestiae dicta atque. Deleniti est est hic veniam. Dolor saepe omnis optio quod ut. Asperiores aut atque ipsa ad aspernatur atque.,2020-02-18T19:17:08.268,58,4,rafael
334,Qui commodi similique laudantium consequatur dolor natus nemo. Officia accusamus est eos. Vero laboriosam odit autem suscipit. Voluptatem optio iusto nobis ut.,2018-05-24T23:38:29.652,58,4,constantin
335,Aut sequi iusto nesciunt dolor. Quam dolor repellat molestias ipsam. Quia dolor sed dolor et perferendis aspernatur dolores provident. Et eos ut debitis dolor ea ipsum. Accusamus consectetur et atque assumenda ducimus non fugiat eum.,2019-05-01T13:41:24.994,59,4,odessa-purdy
336,Autem quibusdam illo non velit. Quis nemo aut nemo qui recusandae porro laboriosam. Ipsum ut aperiam voluptatem non a quidem voluptatem. Reprehenderit quisquam quo porro optio eveniet alias vel voluptatem. Exercitationem a debitis aut ut ipsa eveniet consequatur.,2020-01-31T03:15:39.408,59,1,bradford-dibbert
337,Rem sint ut minima nam. Provident corporis sapiente asperiores maxime. Quae earum earum porro amet quos hic fuga. Occaecati est quisquam dignissimos dolores explicabo voluptatem. Suscipit harum eveniet optio aut aut.,2018-09-18T21:47:29.066,59,4,abdiel.murphy
338,Iure magnam provident neque. Maiores qui delectus velit quae. Itaque consequatur incidunt ratione omnis eos. Iusto enim accusamus explicabo quam. Labore magnam rerum cumque eius quas vel nihil.,2019-07-14T19:58:37.673,59,4,alta
339,Nihil eligendi et inventore eius beatae officia. Veritatis autem at perferendis explicabo qui aut sit esse. Dolorem quae est voluptas voluptas. Qui ad officia ut voluptates et reprehenderit officia quo.,2019-07-11T01:01:06.576,59,5,alf-jast
340,Molestias sit et quod culpa. Sed modi temporibus voluptatem omnis distinctio rerum dolore aliquid. Voluptatem et non ducimus ut non. Ullam accusantium eos et eius quae nam sunt itaque. Sint temporibus enim et tenetur.,2018-11-19T08:00:51.265,60,5,myrna.ernser
341,Veniam ipsa enim beatae beatae voluptas ducimus minus. Vitae voluptate iure autem voluptas eum sed nihil. Facilis atque ipsum ut perspiciatis voluptatem. Non sint voluptas magnam.,2019-01-21T22:48:56.567,60,5,gus.nolan
342,Aliquid dolores ducimus aut error explicabo ullam. Officia hic dolores dignissimos ut quibusdam impedit suscipit. Et sed at blanditiis. Ab iure repudiandae totam sed atque omnis. Necessitatibus dolorum est libero rerum nobis quibusdam eum.,2018-11-24T13:12:29.742,60,5,sheila
343,Facere esse reiciendis illum iusto porro cumque qui. Ipsam debitis et excepturi ut. Dolorem id commodi alias sed a sapiente.,2018-11-28T10:43:17.027,60,4,webster.anderson
344,Optio hic ut omnis voluptatem doloribus ut fugit aut. Necessitatibus quia consequatur corporis libero nobis. Quibusdam voluptatem et quia est architecto quasi. Cum deserunt voluptatibus aperiam a nam tenetur exercitationem.,2018-01-12T11:30:28.948,60,5,watson-leannon
345,Perspiciatis sed a eius aut saepe repellendus deleniti error. Quia ducimus placeat eum deserunt nobis in. Dolor molestiae sunt itaque voluptate fugiat dicta ea. Et distinctio incidunt rem inventore dicta ducimus velit est.,2018-02-16T02:56:08.759,60,1,verlie
346,Laboriosam totam cum quia autem eveniet. Quod et facere molestiae totam voluptates itaque qui. Ab voluptatibus sed voluptas impedit commodi voluptates aut incidunt. Error consequatur hic quam incidunt at. Magnam quo veritatis doloribus inventore quae dolor.,2018-07-08T02:19:36.805,60,4,gertrude-ankunding
347,Expedita ut corporis blanditiis nulla suscipit. Provident sequi ullam illo quisquam deleniti eius culpa vero. Et dolorem sit enim ratione totam facilis odit. Dolor molestias voluptatem nemo. Eum ipsum qui error corrupti amet ipsam distinctio.,2019-12-04T05:52:52.293,60,4,polly.jacobi
348,Mollitia omnis aliquid velit corporis. Quae mollitia quia voluptas enim sit blanditiis. Libero pariatur rem delectus nihil placeat explicabo id dolorem. Sapiente voluptatem voluptatem qui dolorem quis delectus veniam.,2019-10-06T07:30:45.687,60,4,malvina
349,Delectus qui voluptate pariatur modi et. Repudiandae doloribus accusamus in libero earum iure earum. Doloribus quaerat nesciunt optio cumque voluptatibus quis molestiae.,2019-01-27T04:06:12.213,61,3,montana
350,Deleniti hic similique consequuntur. Qui ut modi deleniti molestiae asperiores voluptatem qui. Ut inventore id assumenda unde ipsa eligendi. Quae cupiditate sit deleniti vero. Unde eum laborum perferendis nam quasi unde sed.,2018-01-03T17:51:36.475,61,4,kasey
351,Labore pariatur non beatae labore. Voluptates magni odit cum dolor delectus iste consequatur ut. Voluptates omnis quaerat aut.,2017-06-06T08:23:54.572,61,4,odell
352,Cum iste omnis iure delectus. Doloremque consequuntur non soluta ratione ut nam. Repudiandae voluptate voluptas dolore voluptate qui. Doloribus architecto sit voluptas. Eligendi enim dolor et incidunt saepe ab minima.,2017-04-15T09:17:01.407,61,5,hector-morissette
353,Aut rerum earum fugit itaque tempora repellat modi sit. Eius molestiae ea voluptates consequuntur earum ut dolorem. Ducimus ut voluptas reiciendis fuga deserunt ea ipsa dignissimos.,2020-01-21T19:14:30.747,61,4,cara.breitenberg
354,Accusamus aut officia ut in. Nam voluptatem in pariatur dolorum quidem maxime odit. Doloribus ducimus sit animi est quaerat rem adipisci laborum. Sit adipisci cumque impedit asperiores nulla perspiciatis.,2019-04-25T17:42:47.1,62,5,otis-keeling
355,Error inventore ipsum nihil est suscipit. Delectus repudiandae qui non in sunt. Et aut minima officiis reprehenderit corporis id eum sed. In quas et aut consequatur amet eum eaque laudantium. Ullam sit rerum quisquam in aut earum.,2020-02-28T10:44:16.455,62,3,suzanne
356,Modi pariatur doloremque commodi rem dolorum voluptatem. Esse similique suscipit sunt perspiciatis non est culpa. Nobis soluta aut natus natus qui et. Assumenda pariatur sed omnis. Natus aut rerum delectus eveniet.,2020-04-13T08:30:55.361,63,4,veda
