ID,Body,Created At,Product ID,Rating,Reviewer
474,Sed sit et et minima autem provident est accusamus. Porro debitis aut ea ut commodi quia eos. Reiciendis et est quam necessitatibus adipisci commodi voluptatem.,2020-03-18T21:56:27.811,77,4,dorothy-kuvalis
475,Asperiores et sed dolor magnam quis non. Aut consequatur eaque voluptatem sit sed unde sequi iste. Expedita quibusdam eveniet qui debitis maxime quia. Excepturi fugiat provident incidunt eius consequatur maxime.,2019-02-12T00:42:37.774,77,4,rachael.schamberger
476,Consequuntur omnis deserunt nam voluptatum alias delectus perspiciatis. Ipsum quia unde omnis et nostrum aut id. Omnis rerum dolores accusamus delectus a delectus hic quo.,2020-03-24T21:50:56.929,77,5,scarlett
477,Voluptates architecto officia hic ex accusamus. Repellendus minima unde blanditiis odit. Omnis reprehenderit voluptas ipsa. Animi ipsum error aut velit qui quia id. Alias ipsa saepe accusamus libero.,2018-07-24T01:32:30.852,77,4,garrison.yundt
478,Ipsum culpa nihil et cumque blanditiis. Ex enim qui delectus vitae iste aut voluptatem ea. Rem tempora iusto commodi excepturi ab tempore quidem est. Optio aut qui voluptatem magnam dolorem similique harum.,2018-07-31T11:13:01.577,79,3,kellie.hahn
479,Quos ratione ullam ut. Est molestiae aspernatur ipsum ipsam non neque deserunt. Non nihil et cumque alias tempora.,2019-02-27T09:39:48.18,79,5,ricky
480,Voluptate molestiae in ut autem. Aut et ut voluptas ut rerum nisi pariatur. Asperiores facere velit omnis sed.,2020-02-12T16:57:12.533,79,5,makenna-berge
481,Eligendi assumenda earum repudiandae est tempora sit. Harum mollitia eum eligendi labore accusamus quo doloribus. Quia quos facere asperiores debitis reiciendis non quo. Et dolorem tempore expedita labore qui eos maiores.,2018-01-15T11:26:42.418,80,2,alva-willms
482,Veniam laudantium aut doloribus dolorum sint quod. Est error ipsam deserunt accusantium a omnis commodi. Voluptas ipsum doloremque illo praesentium adipisci libero. Voluptas error ea explicabo. Cupiditate sunt voluptate quia voluptas similique.,2020-04-11T16:27:31.177,80,4,ward-cole
483,Asperiores corrupti sit accusamus numquam sit. Et provident provident ea repellendus. Temporibus omnis qui architecto magnam doloribus porro incidunt quia. Commodi quia dolores ut possimus tempora sed. Officiis et sint dolorum aut optio molestias esse.,2017-01-07T12:34:20.093,80,4,norene-becker
484,Dicta molestiae in dolorem et qui adipisci ea totam. Sed sit quos omnis quod sit nesciunt ipsa. Eveniet mollitia ipsum et et cumque fuga ducimus. Fugit reiciendis necessitatibus ratione ullam ducimus illo et itaque. Quia et facilis placeat.,2018-11-05T06:13:09.141,80,4,marco-leffler
485,Rerum quaerat qui illo qui nostrum. Natus est in autem nisi. Aliquam maiores tempora quia maiores quia similique. Nihil hic ut temporibus nihil quia.,2019-02-24T03:49:30.802,80,4,kailee-crooks
486,Ducimus et omnis temporibus corporis omnis laborum ex. Dolores est sequi iure beatae minus doloribus dolores cupiditate. Ea nisi fuga mollitia error.,2017-11-06T21:02:46.764,80,5,joaquin
487,In pariatur eaque aut. Distinctio aperiam ut hic ullam officia provident quam. Veritatis possimus nesciunt cumque nihil hic quo.,2020-04-19T14:15:25.677,80,5,emely
488,Similique vel ipsam est corrupti dolorem ratione vero fuga. Ipsa sapiente voluptatibus fuga alias. Minima et quisquam non molestiae sed. Molestiae earum dolores dolor eius qui. In voluptatem odio architecto quidem eveniet quaerat et.,2016-10-02T13:29:34.575,80,4,larue.schultz
489,Velit aut consectetur eum explicabo sapiente dolor. Ea deleniti cumque maxime debitis eaque aut. Inventore dolores eum magnam adipisci rem minus recusandae.,2018-09-08T18:29:15.55,80,2,elliot
490,Cumque ipsam aut sunt rerum. Dolores ipsum quod veritatis fugiat voluptate velit placeat. Itaque ullam occaecati aliquam amet sed repudiandae veritatis sequi. Sed et accusantium ut.,2019-09-23T17:08:45.599,81,5,nels-hahn
491,Voluptatem expedita recusandae cum dicta id et. Sint error et necessitatibus delectus. Maiores nemo dolore accusamus quidem. Dolore nobis nihil odit voluptatem placeat doloremque. Magnam nam reiciendis molestiae.,2019-06-17T07:07:39.326,81,4,buck-kertzmann
492,Ex autem ea quia ea praesentium aut iure magnam. Numquam nulla iusto sunt dolor eveniet ipsa quia a. Et optio blanditiis earum blanditiis sapiente sequi magni impedit. Possimus vitae voluptatum voluptas expedita deserunt voluptas. Sed quam sunt laudantium porro.,2017-06-05T05:03:04.397,81,4,alden-jones
493,Animi ad laborum est explicabo aliquam quo error nulla. Est quae consectetur qui et earum delectus. Sunt est delectus nihil nihil id. Velit architecto id harum nihil quam.,2018-10-14T17:03:21.556,81,4,kailyn
494,Omnis excepturi est ipsum voluptatem consectetur rerum. Est qui ea dolorem laboriosam quisquam in. Nisi quo ut explicabo assumenda.,2016-12-06T11:19:17.751,82,4,naomi
495,Earum dolorum sequi sit aspernatur omnis laboriosam quia ea. Aut dolorum accusantium doloribus pariatur hic porro tempore id. Aliquid ut dolorum ullam reprehenderit quia ea dignissimos molestiae. Perferendis rem aperiam est quam quia magnam.,2018-10-25T13:46:41.617,82,5,era.collins
496,Commodi neque cum ut enim impedit accusamus. Et est ipsam quia itaque exercitationem illo. Consequatur tenetur necessitatibus delectus accusamus. Voluptatem iure quae incidunt neque. Veniam officiis est et occaecati qui enim quasi distinctio.,2018-05-14T11:10:45.028,83,2,nicolette-cartwright
497,Possimus eius tempora et ut dolor rerum qui deleniti. Tempore quam neque alias aut possimus quia ipsa laborum. Debitis pariatur quidem quia velit. Sint itaque est repudiandae libero dicta atque a et.,2018-11-30T15:24:35.155,83,4,madisyn
498,Vel consequatur deserunt sint. Voluptas voluptatem et itaque dolorem maiores voluptatibus. Repellat non nam repellat maiores tenetur nisi sed sit. Est dolore unde omnis voluptatibus sint est.,2019-01-08T02:42:24.775,83,5,loyce.haley
499,Est est soluta assumenda et et voluptatem culpa eligendi. Quod et soluta impedit. At voluptatem doloribus eius ut veniam. Quo consequatur vel quaerat assumenda eos dolorum iure. Aspernatur ipsam esse nostrum velit.,2019-07-29T08:08:41.298,83,4,terry.hickle
500,Ea unde ut dicta odio placeat. Animi accusamus vel cupiditate nulla. Exercitationem omnis ut ex iste dolores id repellendus aut.,2017-05-07T10:25:51.738,84,2,jerrod
501,Ut quia ea sint aut inventore accusantium. Vitae explicabo est aut pariatur dolor cupiditate. Ut aut et ad dolor quam quia sapiente eos. Sint non optio sunt aspernatur qui ut voluptatem quis.,2017-10-04T06:56:34.617,84,1,lennie
502,Incidunt veritatis aut est est. Ea cumque porro qui id dignissimos facere hic quae. Cum sint quo et beatae eveniet quia dolor.,2019-12-23T08:32:31.865,84,4,heath
503,Unde explicabo maxime odio. Nihil magnam quisquam possimus accusantium optio. Accusantium enim non alias rem optio. Voluptas molestiae quas est. Est deserunt ea odit.,2019-10-18T05:54:40.546,84,5,deangelo.nolan
504,Tenetur commodi placeat quo accusamus est qui fugit vel. Ut expedita sed quis. Id ut sit molestias dolores aperiam dolore. Velit saepe quis sequi quaerat voluptatem ad in.,2018-06-28T15:02:15.457,84,4,drake
505,Tempore aut consequatur cum accusantium dolores et molestiae cumque. Libero ab aut deserunt voluptates quisquam placeat aliquid. Assumenda corporis quis quasi illo nam consequatur nesciunt tempore. Natus sit molestiae nostrum distinctio est dolor quam facilis. Labore voluptates non ea incidunt deserunt porro.,2017-08-18T01:15:42.651,85,5,judah
506,Sint aspernatur amet omnis et iste aliquam. Optio itaque porro sint tempore. Dolore provident dolor qui. Repudiandae omnis eaque in.,2017-06-15T01:00:37.242,85,5,natasha
507,Ratione est est suscipit eaque sed neque. Quam doloremque incidunt ea quam est veritatis mollitia minima. Praesentium voluptatum sit autem eos fuga provident. Ut dignissimos itaque omnis.,2019-02-11T08:38:50.931,85,3,kellie
508,Non consequatur sint expedita laudantium. Minus porro aliquid qui quia unde. Quis vitae dolor dolore optio. Nam asperiores neque minima molestiae vel quia maiores. Magni voluptatem est amet et.,2017-05-02T22:44:22.047,85,5,destinee-pfannerstill
509,Molestias et sit reprehenderit quo harum voluptate adipisci aut. Voluptatibus sint optio et. Aut doloremque officia sunt provident aut nesciunt. Dolor qui aut rerum magnam.,2018-02-19T09:11:20.935,85,2,sigurd.ortiz
510,Ad maiores optio eum dignissimos. Magni repellat nobis culpa qui qui. Commodi et hic exercitationem corrupti sunt molestias omnis. Molestias nam dolore maxime molestiae. Temporibus quo quia modi sed blanditiis tenetur suscipit error.,2017-11-10T04:05:52.789,85,4,zola.gusikowski
511,Dicta nobis ea quibusdam eos deserunt. Nihil non incidunt excepturi omnis omnis et soluta rerum. Fugit dicta et consequuntur adipisci. Delectus laborum est nihil quia quia consequatur quis facilis.,2017-12-24T16:59:48.526,85,4,darren.gislason
512,Sit non mollitia impedit quaerat. Ea qui ea natus pariatur similique qui amet. Velit consequatur tempore sit. Ab sint atque nesciunt eos minus accusantium. Sint totam possimus unde.,2019-03-25T06:07:24.614,85,5,loy.koepp
513,Ut et quam sint voluptatem quidem consequuntur quo. Quaerat aut ut molestiae ut minus cupiditate quos maxime. Quia ex in quisquam sunt et omnis ut inventore.,2019-04-07T14:46:21.951,86,5,rosa.kuhn
514,Eum quis omnis ullam adipisci voluptate vel id. Doloribus eaque eum odit aut sit voluptates et nemo. Et aliquid et reiciendis aperiam sunt enim.,2020-01-29T21:35:22.94,86,4,jayde.padberg
515,Error ex unde facilis sunt beatae consequatur. Voluptate exercitationem omnis sint. Voluptas sed et mollitia reprehenderit sit repellat explicabo esse. Atque quam qui illum illum cupiditate.,2020-03-03T19:51:23.058,86,2,jaylen
516,Possimus eius quam voluptas nesciunt. Minus debitis perspiciatis eaque facilis commodi sed. Sunt harum quia quia et reprehenderit culpa. Consequatur vel est ex doloribus qui magni impedit porro.,2019-09-21T07:29:01.184,86,4,ruth
517,Sunt illo cum consequuntur. Dignissimos eius rerum deleniti. Fugiat omnis est quos. Et ut tenetur praesentium perspiciatis. Et cupiditate magni perspiciatis facere atque ab qui earum.,2019-11-04T06:33:55.181,86,2,zella
518,Eos quaerat aut optio fugit nisi ea maiores. Itaque inventore iste et reprehenderit odit illo. Odio nostrum et molestias dolor est accusamus sint eos. Sequi omnis alias vero.,2019-07-27T01:29:05.662,86,5,arlene.crist
519,Ut modi iure voluptatem aspernatur veritatis sit. Saepe dignissimos nemo sunt. Et enim sapiente quidem rerum repellat delectus aut. Consequatur dolorem aut culpa in accusamus porro veritatis.,2020-01-12T10:57:11.276,86,4,horace
520,Fugiat cumque accusamus debitis qui ipsam veniam natus voluptates. Inventore quas unde minus suscipit quod. Tenetur minima et dolorem harum sunt fuga non.,2018-10-13T00:36:21.715,87,1,oran
521,Repudiandae voluptatem necessitatibus ipsa dolorum est est eligendi. Sequi dolores voluptatem consequatur. Porro quasi consequatur autem. Nihil reprehenderit et est sunt consequatur id fuga. Quas accusantium sit dolorem nam.,2020-04-15T19:00:51.194,87,5,arnulfo-wunsch
522,Accusantium laboriosam eveniet iusto consectetur. Qui et quod reiciendis et modi perferendis voluptatem. Velit est ea blanditiis. Iure quia quia hic et quas.,2019-01-31T11:35:07.427,87,4,carolina.wilderman
523,Quo sit itaque est in vero animi occaecati tempora. Laborum ut iste consequatur dicta eaque. Iusto est aperiam voluptas qui deserunt. Ea rerum non dolorem aut qui sunt dolore ex.,2018-06-24T08:55:15.545,87,5,jane.miller
524,Illo tempora voluptas laborum. Sequi possimus et eaque qui blanditiis consectetur. Expedita sed soluta nisi optio aut ullam.,2018-08-11T07:53:52.507,87,5,alejandra
525,Id at distinctio sint. Nulla similique pariatur vero libero. Vitae id eius doloribus. Molestiae suscipit provident exercitationem deleniti atque explicabo exercitationem.,2019-11-13T05:24:16.372,87,5,aniyah.hoeger
526,Consequatur placeat alias occaecati iusto aliquid sint. Est sunt quas provident aliquid consectetur dolores quidem est. Velit quaerat et et reprehenderit inventore nihil atque. Suscipit consequatur consectetur est aliquam.,2019-10-18T12:19:58.585,87,5,addison
527,Quia similique qui pariatur necessitatibus molestiae voluptatibus consequatur. Dolores omnis delectus omnis quidem eaque ea iste animi. Dignissimos consequatur atque quo ratione ad. Doloremque beatae qui eius est dolore est sint quos. Tempora architecto sunt excepturi dolores.,2018-07-09T23:35:50.761,87,4,adalberto
528,Aperiam voluptatem consequuntur dolores qui aspernatur est culpa. Harum ut odio modi recusandae quam. Sed non sint voluptatum ut dignissimos est et molestias. Maxime voluptas iure et est placeat.,2018-09-07T01:55:41.948,87,1,vella.schulist
529,Delectus reiciendis quam quae inventore veniam qui. Expedita amet doloribus aut adipisci occaecati. Et dolorem inventore molestias. Iure fuga omnis omnis ut quae accusantium nisi est. Nostrum vitae et et omnis aliquam expedita inventore.,2018-12-27T06:59:29.062,87,2,sibyl
530,Consequatur et est enim porro qui incidunt. Porro nisi maiores ducimus officia nisi accusantium. Iusto et molestias voluptatibus quia. A ut cum nemo illo.,2019-02-05T11:32:14.066,87,4,gage.goyette
531,Fugit adipisci ipsa optio veniam laboriosam nesciunt fuga est. Autem eos ex eveniet et iusto doloribus. Nostrum vero id id labore eligendi non voluptatem odio.,2018-10-31T08:19:45.376,87,5,jacklyn-bartoletti
532,Rem quis et ipsum aperiam ad consequatur consequatur in. Excepturi voluptatem consequatur necessitatibus. Quia nostrum tempora ab molestiae consequatur officiis. Sapiente sunt velit eum veniam aut.,2018-12-21T09:04:11.215,87,1,cassidy
533,Quos odit soluta omnis qui atque doloremque ex commodi. Ad alias quidem quis fugit quos ea veritatis ut. Labore amet cum numquam deserunt aut odit odit qui.,2020-03-04T02:15:57.267,87,4,serena-lind
534,Suscipit vel quasi quis laudantium vel laudantium similique. Ab autem eum iure placeat quo voluptatem aut. Sint nobis mollitia consectetur ut ut illo nostrum. Explicabo nostrum a laboriosam quaerat.,2019-06-30T13:34:49.662,87,2,eda
535,Provident repudiandae consectetur ut. Est sunt impedit ducimus totam. Eius dolor sapiente et aut hic. Et placeat nobis ipsa et. Est nesciunt necessitatibus itaque et dolorem iusto.,2020-01-27T02:09:40.918,87,4,casimer
536,Nam architecto totam qui ullam maiores est aut. Qui fugiat quidem itaque corporis. Fugit aut provident ea fugiat ex repellat.,2019-01-18T21:19:39.082,88,1,enos
537,Consequatur optio sit libero est odit eveniet. Et placeat et quisquam. Aliquid consequatur modi modi ut. Enim sunt dignissimos tempore. Velit necessitatibus assumenda blanditiis est reprehenderit nostrum.,2020-02-09T06:43:48.364,88,4,brisa-schimmel
538,Mollitia sed quo illum non sit id sunt non. Tenetur et sed nobis hic. Et accusamus et voluptates rerum amet autem. Omnis non non enim laboriosam. Repellendus nihil quis qui dignissimos fugit.,2020-01-29T07:19:43.287,88,5,emil
539,Iste vel eum voluptatem sequi aut. Exercitationem qui rerum aut modi. Dolor maxime dolores eius dolor laboriosam et sunt.,2019-10-08T01:45:54.158,88,4,oscar
540,Qui ut quo temporibus quis totam. Assumenda ratione nisi facere modi qui. Expedita qui praesentium ullam vero. Omnis illum possimus cupiditate perspiciatis delectus est. Aliquid velit mollitia cumque consectetur.,2020-03-11T22:29:08.802,88,4,jamarcus-bechtelar
541,Recusandae aut velit tempore suscipit est autem. Fugiat ad animi architecto sit. Ut ullam voluptatem commodi totam nihil quas. Saepe non eveniet autem. Earum aut in sunt doloribus ut quam qui maxime.,2017-03-13T11:29:11.466,89,2,deangelo
542,Hic id quae vero ab eum aspernatur. Libero qui sit qui inventore ea. A facere sit non facilis. Veniam dolores et ducimus cumque excepturi suscipit doloribus nisi.,2017-05-24T03:09:54.635,89,4,lucius.gulgowski
543,Velit et quisquam laborum dicta odit libero voluptatibus. Omnis deleniti magni distinctio odio. Eligendi ducimus temporibus omnis quo veniam. Quos est voluptatem similique sit quam nihil.,2019-07-10T10:46:03.035,89,4,armani-robel
544,Aut aut eum vero atque velit vel. Dolorem sunt animi facilis voluptatum aut. Aliquam rem omnis possimus.,2018-01-01T00:34:39.775,90,4,deja
545,Sed eos eveniet ducimus molestiae atque dolor quis commodi. Laudantium necessitatibus eligendi reiciendis itaque nesciunt et. Inventore officia id exercitationem consequatur. Unde alias voluptates iste perspiciatis quidem voluptatum consectetur. Sint id sint officia fuga minus.,2018-10-24T01:46:57.269,90,4,osvaldo
546,Quas atque qui vero fuga ut occaecati. Unde pariatur modi dignissimos eos explicabo eos. Debitis eveniet et facilis.,2019-05-14T02:36:23.137,90,4,rosalyn
547,Molestiae quidem debitis et maiores blanditiis harum amet. Necessitatibus dolorum nostrum id eos. Quasi labore sed quasi nisi et quidem voluptate quod. Enim sunt doloribus voluptatum. Nam cupiditate odio autem voluptas totam tempore rerum molestiae.,2019-01-30T23:22:53.647,91,5,norwood
548,Eaque et natus cupiditate sunt. Accusamus temporibus est molestiae unde eum quisquam est. Voluptas voluptatum possimus nobis ut consequuntur eius minus occaecati. Id culpa iusto at.,2019-01-14T03:08:57.513,91,5,rossie.waters
549,Ducimus voluptatum est iure animi est minus eos. Ut sint nulla accusamus. Placeat eveniet omnis dignissimos.,2019-01-12T22:58:24.221,91,5,webster
550,Excepturi omnis qui ea placeat. Sed illum voluptate aut quia. Tenetur est odio aut. Suscipit esse accusamus eveniet itaque aperiam ad modi.,2019-02-23T01:56:54.466,91,5,bradley-mohr
551,Ea et eos cupiditate adipisci sed sed consequatur. Quod qui voluptatem dolor. Aut quos maiores et sit quas odio exercitationem molestiae. Distinctio corrupti nobis commodi.,2020-01-28T14:48:00.426,91,4,florian-hahn
552,Maiores et libero iste pariatur nesciunt. Nesciunt aliquam iure odio. Et voluptate eligendi laborum dolor dolores fugit eligendi sit.,2019-10-02T03:37:19.45,91,4,kenna
553,Suscipit ut eos officiis et velit. Sunt adipisci placeat ut unde officiis excepturi. Veniam rerum molestiae qui nesciunt nemo. Sit fuga assumenda eaque ullam enim. Animi illo libero incidunt omnis assumenda.,2019-06-26T12:33:56.667,91,4,mac-schimmel
554,Temporibus voluptatem velit maxime. Voluptates fuga quis eos ullam culpa sed. Eum et et dignissimos. Accusantium totam laboriosam aut sed.,2019-07-15T02:21:21.246,92,4,alexander
555,Ipsum autem voluptatum numquam quod nostrum facilis iusto. Voluptatibus rem modi minus alias. Et id voluptas enim minima. Facere excepturi commodi adipisci.,2017-06-24T22:10:10.177,92,4,mohammad.schoen
556,Molestiae laborum dignissimos optio dignissimos repellendus dolores. Qui aut aut et voluptatibus quis. Sed non et aliquid quia eaque magni occaecati.,2018-02-13T19:37:39.439,92,5,marjolaine.rau
557,Sed hic quia consequatur quis aperiam dignissimos dolorem. Autem quisquam veritatis voluptates et iste dolore. Nesciunt non non aperiam placeat quo voluptatem numquam aut. Est voluptas veritatis et at.,2018-07-05T10:27:12.522,92,4,isom
558,Repellendus culpa totam qui et expedita asperiores pariatur. Delectus itaque voluptatibus quia aut est quos aut perferendis. Inventore aut vero rerum explicabo adipisci ea alias. Voluptas sed mollitia laborum autem.,2017-05-29T10:17:36.194,92,3,kayla.bins
559,Nihil officia accusantium laboriosam et odio. Quidem in ut doloribus qui cumque recusandae. Non qui et est suscipit est consequatur natus. Similique alias sint itaque nam occaecati sed voluptatibus. Sit blanditiis autem non doloribus.,2018-11-09T22:29:45.85,92,5,myles
560,Laborum voluptas corporis est non rerum consequatur voluptatibus. Dolorem libero accusamus sit. Neque nihil quae amet aut occaecati laudantium quod.,2017-11-22T19:02:31.191,92,5,kody.green
561,Iure vel unde consequatur earum. Officiis aperiam distinctio dolorem. Cum et beatae nesciunt sunt reprehenderit. Quidem voluptatem ut dicta nemo dolorem hic possimus velit. Sit aut eum rerum dolorum nihil voluptatem.,2019-04-11T12:31:05.243,95,4,ronaldo
562,Sunt voluptatem id natus earum dolorem voluptatem et consectetur. Saepe placeat quos sunt repudiandae voluptatem. Numquam beatae ipsam et. Quia quia perferendis deleniti aspernatur. Enim sunt ratione numquam ut minima dolor molestias laboriosam.,2019-03-20T21:55:09.151,95,4,rodger.stroman
563,Sunt cupiditate rerum magnam inventore aperiam sed aut adipisci. Iste dolorum voluptatem dolorum maxime non voluptates. Aspernatur perspiciatis voluptatem reprehenderit enim repellat harum culpa. Quia ut est a commodi maxime. Sint eligendi possimus sint excepturi eos porro doloremque autem.,2017-10-01T20:17:14.194,95,4,stevie
564,Dolores harum iste dolores asperiores rerum sunt consequatur numquam. Molestias perspiciatis quibusdam dolorum voluptatem facere. Quas et facilis doloremque velit asperiores molestiae dolores id. Dolor similique ut sed sint sed commodi.,2019-01-10T13:55:09.274,95,3,evert
565,Labore error deserunt vel et voluptas dolorem. Sequi nobis nesciunt ad. Atque tempore animi et necessitatibus excepturi.,2019-06-06T13:00:01.538,95,4,jarrod.leuschke
566,Natus atque ea porro inventore rerum. Eveniet nam fuga quos tempora voluptates quod ea. Quia sit consectetur voluptas facilis accusamus totam officiis. Aut quaerat aliquam fugiat blanditiis quaerat. Et quas iste voluptates ut et.,2017-12-27T18:42:50.048,95,5,judah-okeefe
567,Consectetur a adipisci exercitationem eum perferendis ad ex et. Amet iste at inventore soluta veniam perferendis cumque. Reprehenderit et nisi recusandae. Molestiae aspernatur consequuntur consequatur eum nulla ut.,2018-08-17T21:44:03.871,95,4,newton-deckow
568,Totam qui iusto enim beatae maxime. Numquam illum voluptatum dolorem nisi quia. Ex nesciunt corrupti eveniet deserunt veniam cumque dolor.,2019-10-09T13:24:10.99,95,5,brad-hand
569,Voluptate quis animi maxime deleniti unde. Quis occaecati nam nulla maxime. Excepturi cupiditate quaerat mollitia quaerat aut. Sed nesciunt neque repellendus. Temporibus iste quia quia eaque qui perspiciatis.,2019-06-15T00:22:28.099,95,4,camille.bailey
570,Non omnis enim quo magnam voluptate. Velit aut est ut labore. Doloremque voluptatem minima ratione voluptatibus ex at cumque provident. Eius reiciendis facere expedita.,2019-08-23T10:15:18.294,95,4,verlie-murray
571,Enim doloremque odio officiis. Alias iusto eaque optio pariatur. Aliquid non quia officia quia placeat nisi. Laudantium doloremque nobis velit quia.,2018-09-18T16:08:38.855,95,5,kim
572,Est ad dolorem odit vero et quas sunt. Atque voluptatem suscipit et. Placeat rerum hic esse dolor reiciendis.,2018-12-27T15:54:33.414,95,4,frederique-prosacco
573,Qui laudantium quo illum laboriosam et veniam aut. Id explicabo sequi expedita qui et explicabo. Hic praesentium eveniet fugiat in iure cupiditate.,2018-09-23T21:47:32.4,96,5,elvie-zieme
574,Totam quis officia vel omnis labore. Pariatur exercitationem voluptatibus quis ut. Qui quasi est libero voluptatem quasi aut quod.,2019-01-10T08:29:31.955,96,5,kennedi
575,Corrupti tenetur nisi ut minima est facere nisi. Consequatur perferendis corporis vel pariatur. Et deleniti vero et aut facilis illum temporibus debitis.,2018-03-26T10:17:08.367,96,2,garfield
576,Beatae perspiciatis qui eius aut. Explicabo aliquam at laudantium incidunt. Nisi autem quidem et cupiditate qui. Ducimus esse cumque sunt quia ullam sed reprehenderit.,2018-10-07T22:27:03.125,97,4,abbey-heidenreich
577,Dicta voluptas perspiciatis in. Magni reiciendis id quod nihil at culpa nulla qui. Et enim itaque rerum dicta quaerat non.,2020-01-30T16:53:05.313,97,4,alberto
578,Ex non earum et est itaque pariatur. Aut nihil ipsa molestiae occaecati. Hic aut beatae dignissimos atque sed possimus enim. Provident omnis ullam magni consectetur quod fugit eos. Et velit dolores nostrum fugit.,2020-03-19T23:14:52.98,97,4,alberto.feil
579,Eos ut voluptatem tenetur esse ab est accusamus alias. Voluptatibus asperiores excepturi unde voluptatem laborum eaque est. Provident ut optio ipsa aut laboriosam ex. Dolor iusto nostrum maxime. Qui esse quis soluta.,2019-04-13T15:07:34.94,97,4,assunta.block
580,Assumenda velit voluptatem officia ex. Laboriosam et et debitis veniam. Vel sed tenetur sit et sit voluptate rerum odio. Et eum qui unde id eos qui. Accusamus voluptate voluptatem laboriosam quibusdam et exercitationem aut quaerat.,2019-08-02T04:09:59.464,98,5,toni.morissette
581,Vel sit expedita nam hic. Tenetur veritatis incidunt saepe est. Dolorem sit quos facilis.,2019-06-03T12:21:10.16,98,4,rowan
582,Facere eum libero delectus nostrum sequi nobis enim nulla. Praesentium consequatur voluptatibus pariatur dolor culpa corrupti. Adipisci qui iure reprehenderit corporis saepe consequuntur.,2020-02-16T07:16:43.181,98,5,esperanza
583,Sunt deleniti sequi sequi nesciunt et voluptas. Qui similique enim fuga corporis autem id. Assumenda sit inventore nesciunt eos modi.,2020-03-24T18:50:43.44,98,4,antonetta
584,Qui et in vitae voluptas similique rem illo. Nemo perspiciatis eaque aperiam. Aut earum aliquid soluta dignissimos omnis.,2020-02-28T20:54:39.074,99,5,nash
585,Eos eligendi similique consequatur. Rerum excepturi sit ea perspiciatis voluptatum et officia itaque. Ipsum modi vel eius facere. Repellat quidem qui quia voluptatum.,2019-02-18T08:44:59.246,99,4,hans
586,Debitis eius reiciendis praesentium. Fugit temporibus est possimus ab quis. Sit aut error iusto impedit nesciunt.,2020-02-22T02:09:34.524,99,2,kamille.dicki
587,Ut aut quia harum suscipit aliquid atque. Sit doloribus ut voluptas et. Minima quam rem temporibus minima ut ea. Deleniti omnis quia sit.,2019-06-06T06:46:40.237,99,3,savanna.moore
588,Aliquam sed enim numquam fugiat. Dignissimos doloremque ut optio omnis temporibus necessitatibus. Deleniti odit voluptas impedit.,2019-03-20T02:13:07.669,99,2,randal
